id,text,label
2085,i just have to study for three and a half more years until i start working on a masters in electrical engineering feels like it never ends .,0
2086,rapper kanye west caught pooping at the empire state building .,0
2087,"i see instead large scale riots along ethnic lines ... quickly started , quickly suppressed and marital law instilled .",0
2088,maybe they 're so far into lies that it 's hard for them to comprehend the truth as it may be coming to them too much .,0
2089,there is a survivor support page on facebook .,0
2090,africa is a hole area of natural resources and only made mud huts from it ... what wild life are able to make even better huts ie birds,1
2091,"after the party and kid 's games , there were two dozen little `` houses '' set up in the parking lot for trunk-or-treat candy for the kids .",0
2092,this should be on every major news channel in america .,0
2093,an ape without a penis will never be able to pass it on to others .,1
2094,"yeah, it surprised me .",0
2095,"check out the rebelsong downloads , you can hear the newest up and coming white power bands , cradlesong and patriots call .",0
2096,i was also wondering if any of you all believe if any `` subrace '' is superior to another ?,0
2097,somene was telling me somewhere that he has put in a claim about having been abused in an orphanage by one of the religious orders .,0
2098,swim back to liberia--with a jew under each arm !,1
2099,russians .,0
2100,racist attack on tv show south africa bbc - youtube,0
2101,ugh ....,0
2102,"a nationalist white network is a really good starting point ... then we could eat in white restaurants , sell or rent our houses to white people , buy our groceries in white shops and so on",0
2103,so racial preservation is the basis for white nationalism and white nationalism is the method with which we want to preserve our race .,0
2104,if her eyes linger ................................... she 's yours .,0
2105,i really hope she overdoses or something .,0
2106,i looked them up on the internet and could onyl find hatewatch and anti sites .,0
2107,it was also the only day i wanted to do that .,0
2108,"hey, i am in mesa ..",0
2109,for when a people is not willing or able to fight for its existence -- providence in its eternal justice has decreed that people 's end .,0
2110,i thank you for your dedication to our cause .,0
2111,"yeah, swamp soccer is the real sport ... beer , naked men , men in flower dresses actually , i was planning to attend with a girl team one year ... unfortunately it didn ´ t happen youtube - swamp soccer - finland",0
2112,holding up signs that say `` god hates fags '' is a bit much .,0
2113,ages from 18-21. please write me back.xoxoxoxoxoxox,0
2114,"that sounds like hippyism. im not leaving my children 's values up for grabs. as ive said before , if parents dont feel their children 's heads with good things then the pc patrol will definitely feel their heads with bad things .",0
2115,if anyone can tell what happened on this lake ?,0
2116,slowly making my way through a romanian bible i got for my birthday in july .,0
2117,are you sure on the bsa thing ?,0
2118,"these in russia i saw was pure black as black as can be , maybe some of them was `` tourists '' and `` students '' but the ones i seen near the out door music show was wearing dirty clothes in their late 20s big gang off them , even seen a girl dating a black .",0
2119,lervik does not sound like a name on a person but is rather a name on place .,0
2120,every ethnic ukrainian i have ever met was white .,0
2121,the illustration of old west ghost towns is something that every american can relate to .,0
2122,-- palatka police said a woman is recovering after two men brutally attacked her inside her home early wednesday morning .,0
2123,i saw his latest movie and was actually surprised that there were no blacks in it .,0
2124,"take it slow then gradual , hell make them watch mtv for a few hours it 's the same thing as animal planet. and just gradually introduce them to your views .",1
2125,"everytime i hear the word `` yugo '' i think of that scene in dragnet , where sergeant joe friday says `` the department furnished us with a 1985 yugo , the cutting edge of serbo-croatian technology !! ''",0
2126,we have such a huge asian problem .,1
2127,"i readnesta webster , gary allen , douglad reed and the protocols over30 yrs ago and i feel sorry for you who cannot work roundit or throughit .",0
2128,you will know it is a nightmare on day you wake up and you have a black muslim running your country .,1
2129,it 's an unfair representation of a nation some random bulgarians [ img ] [ /img ],0
2130,graduated two years ago and still do n't miss it .,0
2131,cheers brothers russia & serbia 4ever !!,0
2132,"im a 21 year old white woman , mother of one 2 year old boy. i have been looking for others like me in oregon for quite some time now and have ony found a few .",0
2133,"decaying , rotting malls inhabited by rats , wild dogs and homeless former retail employees will be a blight on the suburban landscape for decades .",0
2134,"if you 're a christian anyway , use christian identity as your excuse .",0
2135,ika klansmen,0
2136,"for a start , the main character has a change of heart .",0
2137,the soldiers of today may face this same treatment before they die if things keep going the way it has been .,0
2138,"123 - bg 456 - mk 78 - bg 910 - mk 6 errors from 10 , as you see is same like before , average answares are 5 / 5 , 1 less or more do n't change it .",0
2139,the guy in this is acting .,0
2140,"white nationalism is not about superiority , it 's about the 14 words .",0
2141,hopefully they will get deportation orders and be on the next flight back to cairo .,1
2142,"it looks like a good kind of army , with occasional internet access .",0
2143,"kountze is ~ 70 % white , 23 % black , & 5 % hispanic , so i looked in the area. in a good way. source : city data",0
2144,"fight proud england , fight",0
2145,i am in the same boat as you to an extent .,0
2146,"beautiful scenery , music , campfire and good , true company .",0
2147,no doubt they 'll be coming up with chocolate-colored leprechauns and a chinese flavored uncle sam 's too .,1
2148,like said definitely learn how to use it properly because even practicing it you can injure your neck if you do it wrong .,0
2149,"enforcment.area , but , i.feel.asthough.that 's.part.of .the.towns.appeal.for.our.purpouses.",0
2150,with black girls it takes a baseball bat - who carries a mu-ff' in baseball bat on a date ??,1
2151,"we spent too much time and effort worrying about blacks while the asians and hispanics , were the ones carrying the ball .",1
2152,my name is sunofsvarog .,0
2153,romanians and italians are fighting with one another while the enemy of all latin people and of all aryan humanity is laughing up his sleeve .,0
2154,the main free stuff page for this month is here .,0
2155,he wrote the truth and you dont know if he is white or not as none knows who post here is a confirmed white .,0
2156,look at it this way : most goths/emos/punks are white .,0
2157,america: 25 percent of american students pass their geography america : 25 percent of american students pass their geography `` speak for change,0
2158,i've always been partial to lully and rameau : jean baptiste lully - l' orchestre du roi soleil - youtube jean philippe rameau /// orchestral suites - youtube,0
2159,"that sounds promising , and hopefully in time there will be a couple of more days added and the extra hour too .",0
2160,it's good to see someone actively trying to make a difference and reach out to people who otherwise might never realize that there is more than one side to any belief .,0
2161,then get one to submit an intro video to the show amd see where it goes .,0
2162,david duke with bruno gollnisch !,0
2163,an good education is allot but not everything .,0
2164,"many thanks dr. duke on behalf of all us internet radio addicts , your davidduke.com interviews are always very much appreciated !",0
2165,"half italian on my father 's side , my mother 's white but was adopted so half of me is a mystery .",0
2166,i've taken a few dance classes at various times and enjoy it .,0
2167,you cant protest there for this ?,0
2168,yeah it just jews stealing stuff from other martial arts. dont worry about it unless they try to recruit you for the mossad,1
2169,i've always said that black people make the perfect slaves because anyone who cannot or will not take responsibility and be master of their own lives is already a slave .,1
2170,my dads good friend left for sudan about a week ago for a bonb disposal company on a three month assigment .,0
2171,most of these videos belong on the animal planet tv channel .,1
2172,"i read where they came in and killed all the livestock and had a feast , then 6 months later were starving .",0
2173,well you are too your family tree comes from macedonia also the white part of it anyway .,0
2174,i've been looking for a proud aryan women to help me in the distribution of literature and for a long term relationship .,0
2175,graphic youtube - video jamaica stay wallin rasta man chops taxi man with a machette in broad daylight !,0
2176,those nations are all extremely diverse .,0
2177,it's a shame that universities of canada import black and brown people .,1
2178,btw - i do n't recall seeing a mars bar in s.a ?,0
2179,their english language means they are drowning in the mlk-esque crap coming out of america .,1
2180,let 's try it again .,0
2181,"obama chooses to identify as black , and zimmerman chooses to identify as hispanic .",0
2182,"still snooping , eh ?",0
2183,vancouver ?,0
2184,you will love this : : // got out of the air force and went straight to the head of hk. wow .,0
2185,we're speaking out against our race being destroyed and this guy is making up hypothetical scenarios about snack time and windowless rooms .,0
2186,those i allude to ....,0
2187,it would be great if we could get every last white out of there so no one would be there to fix things .,1
2188,"duetschgirltx, no i live in a tiny ass town where i am only one of 100 white folks ( maybe less ) . near san antonio. there are so many dirts around and they all stick together. so when it comes to a white girl in this town i gotta have my own back always is that where you are ?",1
2189,"budapest 1919 , trianon 1920 , ring a bell ? 2013 , our military is still vastly superior to yours as it has always been !",0
2190,"-strictly , no goyim friends .",0
2191,"both the winchester pdx and the 3 `` 000 buck would brighten any room , giving visitors the reception they have been looking for !",0
2192,this is a video of old postcards of the upper silesian city of bytom ( beuthen ) .,0
2193,not only is this case typical of the feral sub humans but it 's a perfect example for our people of how totally out of control they are and that they cannot be allowed to remain among us .,1
2194,"yes, i have very rarely seen scandinavian-looking people with brown eyes .",0
2195,i went to buy some new socks today and a couple of t-shirts .,0
2196,hundreds of millions white people have !,0
2197,ok.,0
2198,"lol i only listened to bulls on parade cause it gave me that angry rush i like from music , but now i 'll stop listening to that trash .",0
2199,i think it 's quite ironic that they want to ban the burkha when they look like they are dressed in them themselves .,0
2200,more like hongcouver ?,0
2201,the islamic disease is even more dangerous than the more obvious black or yellow disease .,1
2202,how about when hitler says that the jewish question will not be dealt with until after the war ..,0
2203,"in eternal combat with that satanic spirit - the physical incarnation , creation of the demiurge : the jews .",1
2204,each lemming that hears duke will awaken .,0
2205,"billy - `` that guy would n't leave me alone , so i gave him the trudeau salute . ''",0
2206,"im living in burnaby , all i see is chinamen everywhere ... what happened to the great colony built by the british empire ?",1
2207,"one guy 's face is clearly shown at the end , and the coon in the suit is a well-know football player according to this article .",0
2208,you went there .,0
2209,researching your topic and facts is as important as compsing your essay .,0
2210,for you and i and other white nationalists yes .for french law unfortunately they are french .,0
2211,i wanted to shoot myself when i was there .,0
2212,them damn wiggers need a friggen reality check. its bad when a white person walks to another and calls him his `` dawg '',0
2213,"true , it is hard for white men to find good white woman and it is just as hard for white women to find a good white man .",0
2214,"from 1860 to 1990 canada had brought in over 200,000 immigrants a total of 9 times .",0
2215,"i was going to say that sod it i will say it any way f .. k you too , and f .. k off .",0
2216,"as others have pointed out , it 's a great slogan .",0
2217,they do n't even claim their white parent .,0
2218,i can picture him as that baby monkey on the ' save the rainforest comercial or whatever,1
2219,good luck to you and your knight,0
2220,"me thinks genesis is a negro who thinks he 's from the line of adam.a troll , confused , black and prowling stormfront.so make the revelation genesis - what are you really up to ?",1
2221,"found this great link while surfing : .... tion = home.home new and expecting parents receive free baby products and coupons from major baby companies such as gerber , nestle carnation , and mead johnson nutritionals .",0
2222,"its time for ireland to cop on and stand up for itself , this whole eu thing is a heap !",0
2223,"would the gentleman kindly tell us , can wogs be irish ?",0
2224,"no doubt thats a lovely gun , if i had the money im looking at a benelli as my next shot gun ... also the price of single shot shot guns have gone sky high",0
2225,if there 's nothing to hide why ban it,0
2226,but what do you expect with a homosexual muslim as the mayor ?,1
2227,i think they are going to have to do a better job of trying to show where the ' bias ' is in these sat 's .,0
2228,you cannot judge the country and its people on those men alone .,0
2229,"it 's the mechanism of death that 's in question , along with the one-sidedness of remembrance , but people did die .",0
2230,i think it is a bit late to think to look after the safety and the future of white people in south africa .,1
2231,"if not kept in check , we may very will be living in an actual planet of the apes soon .",1
2232,an ar10 does n't really fit into that .,0
2233,"yeah, thank god for fingers ....",0
2234,here 's what i mean when currently wn have to operate under moscow rules .,0
2235,the mass killing of jews should be partly britain 's fault but the western zionist world wants people to forget about britain 's imperial past and lay the blame on white nordic nazi germany .,0
2236,do you think the state would let them exist otherwise ?,0
2237,"cool, finally got it working just in time to hear someone call in and let the host know that thanks to stormfront , the show is being listened to all over the world .",0
2238,hi there best way to lose the pounds i use to be 395lbs i tried very diet program on the market 4hr at gym very 3days until friends told me easy way to kept the pounds off it may sound funny don t eat anything white .,0
2239,historic vehicle laurin klement t. b 1899-1903 white loop-frame motorcycle with pedal start awesome custom replica of 1900s czech .,0
2240,i feel pretty alone alot of the time at mine .,0
2241,precisely!,0
2242,you need to join a nationalist organization so you are more part of the scene such as the nationalist party of canada .,0
2243,"( prince of bel air , moeisha , etc ... )",0
2244,swissgirl is your teacher openly gay ?,0
2245,then we can all live in a global utopia with the jew running the show - cant wait nothing short of a brain transplant is going to raise a negroes iq .,1
2246,"thank you for all your support , i have a great list that i am going to look into picking up .",0
2247,you will see much worse things in the future .,0
2248,the poor sod was srceaming the whole time .,0
2249,"may they just need to turn these savages loose , justice will take care of itself .",1
2250,they probably have a 150 i.q. with all three of them combined .,1
2251,it's indeed a conspiracy theory that insists whites work together to hold black people down to benefit whites in some way .,0
2252,so there white and there against racism or they like monorities against whites ?,0
2253,here is another view of this very thing : song of albion there are some really good words of advice for white nationalists in the last chapter ... should get some people talking .,0
2254,"as i said when the races are mixed its more difficult but they can between a white , black or asian and that proves that races exist .",0
2255,"as a 28 year old straight white nationalist male , nothing turns me on more as a white woman who is powerful or successful in the buisiness world or just as powerful in her own beliefs ..",0
2256,what else can i do ?,0
2257,i have always thought ireland to be the last all white country left .,0
2258,don't care much for football these days and sincerely hope that the team called england get a hiding but i will be wearing my new serbia shirt during the tournament.come on serbia do us proud !,0
2259,"hi: i want to share these wonderful videos , very beautiful teachers and great new methods for everybody can easily learn .",0
2260,was hoping it would be to commemorate the plantation as a dark part of our history but it appears to be celebrating it .,0
2261,looks like it went straight down the open breech and cooked off the ammo .,0
2262,"[ updated : ] bessie whyman , oc homicide no. 3 : 84-year-old robbed , tortured and murdered - orange county news - navel gazing",0
2263,try el paso texas soo much mudd invasion that the river is the same color as those playing/crossing in it .. year round !,1
2264,"blacks can shoot , funny thing is they only seem to be able to hit the little innocent law abiding child , walking home from church to help take of their sick mother .",1
2265,stupid is when someone do n't want the truth .,0
2266,whites get along with asians much more than they do with blacks or hispanics .,0
2267,"( at 27 : 00 - 32 : 00 , 48 : 00 and 50 : 00 of the link they discuss moscow rules ) smiley 's people - part 1 ( bbc spy tv series ) - youtube with our own civilians in ple 's supporting us , even in little ways such as providing cut outs and safe houses , putting out propaganda will be much easier .",0
2268,hear hear !,0
2269,no wonder this races achieve nothing .,1
2270,like made good money .,0
2271,they preach diversity at their professor jobs and government jobs and it makes those white liberal neighborhoods and gated communities too white and in need of some `` black flavor '' at home the joy of diversity right in their white daughter 's bedroom !,1
2272,i am not expecting six figures a year but would like to be comfortable .,0
2273,i have family there .,0
2274,"just a note for anyone downloading the petition ......... remember to put your paper setting on 8 1/2 x 14 for * * * legal * * * documents. petition download good luck friends , gordon _ inc.",0
2275,who the hell cares if its not kosher ...,1
2276,"its simple , your white. your genetic code doesnt include a racial commitment to crime. be glad and for for those reasons. this is what society has turned into. take a stand and defend your race. we must secure the existence of our people and a future for white children.-david lane white racial loyalty starts here keep it white",1
2277,your dealer is messing with you .,0
2278,i made copies and passed em out to friends and family .,0
2279,let 's just hope this is n't worst case scenario .,0
2280,yes but most are not even brown or tanned .,0
2281,i love the home school idea and very much admire parents who care enough about their children to make the commitment necessary for it to succeed .,0
2282,nice find on ebay as well,0
2283,to post it on a public message board is just inviting disaster .,0
2284,clearly there is a need for more alternative media in this country .,0
2285,hit first and hit hard .,0
2286,"i cant wait , i 've been wanting something to say to these wiggers , but i can never find the right words .",0
2287,"the hubble images were combined with images from the keck telescopes taken on aug. 20 , 21 , 30 , and 31 to measure the satellite 's orbit and calculate a mass for eris , which is the largest dwarf planet in the solar system .",0
2288,this boy is not tatar-looking .,0
2289,"if your house door was locked , but at midnight your neighbor opened the door for some muslims to come inside and take your stuff , rape your wife and beat you nearly to death ... would you still think your neighbor was a nice guy ?",1
2290,"emporion ballista in museu d & ; arqueologia de catalunya , barcelona , spain - youtube remains of the ballista found from archaeological excavations in greek town of ἐμπόριον ( emporion ) near present day town of l' escala in catalonia , spain .",0
2291,"i like husband in a decent pair of jeans , a well fitting shirt , and a pair of boots ...",0
2292,have you ever ridden your dirt bike to florida ?,0
2293,"if an anti-white submits an ignorant or profane post , then calling him/her a stupid ass , lame brain knucklehead is not a racial slur .",0
2294,frederick neichzche embraced the notion that for a race to evolve there had to be a struggle to kill of the weaker elements to keep them from contaminating the gene pool. in the us one could say that there is a breeding program to breed dumb ghetto blacks .,1
2295,post the topics discussed in class as they come up on this thread .,0
2296,there was a thread here somewhere long ago about someone who went to a police station and saw they had it on the wall for public information ; probably the adl has mailed these to many police stations .,0
2297,solvent soaked patches ∙ brass bore brushes ∙ just could not get perfectly clean .,0
2298,conservative and white .,0
2299,"that's a good point , awake777 .",0
2300,their is a group of people behind the scenes orchestrating your destruction and they are using non whites as tools to accomplish their agenda .,1
2301,"exactly, especially since all the photos are white on white or in a few instances black on black .",0
2302,burlington coat factory opening .,0
2303,"i do not blame you , ottawa like all of our cities is a multicultural hell .",1
2304,"here are some sites that i find to have reasonably reliable information on current events , and other topics .",0
2305,responding to edit comment .,0
2306,"what was once public employee , is now worker .",0
2307,"only in the mind of the international jew could such an evil machination , with its ticker tape parade of lies , be cooked up !",1
2308,"that was on a sheet of paper , and i take it you meant bull sheet ( as other poster said it before )",0
2309,"i'm from the suburbs of chicago , everyone always says there are alot of skinheads out here but i have had trouble finding any",0
2310,german knight symbols for my company warchief - the academy of unconventional warfare .,0
2311,do you see this symbol any ware ?,0
2312,the english policy was one of extermination from day 1 .,0
2313,were whites to leave in large numbers leaving few whites behind in south africa the country would start going down hill and then maybe more whites would begin to see what losers negros are and how they cannot even maintain what is given to them .,1
2314,"this is a great resource , but they have practically no pro-white books in their library .",0
2315,"come on guys , help her show her kids the right way .",0
2316,here is peroutka 's latest on jerry falwells blind support of bush .,0
2317,"hey remember the japanese where on the good side during ww2 on a light note , ya , i can be idolized and all my coworkers , we are all heroes ready to build the next rail gun cannons that will power ww3",0
2318,"welcome to stormfront , eldritch !",0
2319,welcome to the fight .,0
2320,it 'll be a welcome change to see a fellow wn from seeing hundreds of lefty bastards going to see ratm .,1
2321,"these areas that you name are the preserve of the rich , you wont find a single white working class person living there.we might look down on blacks and pakis as scum and not want them living near us but the upper class feel exactly the same about us",1
2322,i was reading a news paper today and there was a picture on the front page russian youth causing the destruction while kyrgiz are staring at them,0
2323,your in ya cell 22 hours a day here u dont in general walk around the landings .,0
2324,she 's never had a lesson !,0
2325,"that literally hurt my brain and made me laugh while i was reading it , it 's so ridiculous that you really ca n't do anything else .",0
2326,"new york city : aborted black babies outnumber live-birth black babies according to the city health department , 2008 saw 89,469 abortions performed in new york city seven for every 10 live births .",0
2327,there are lots of brown and black kids in the system gays could adopt .,1
2328,i was just about to post a similar thread .,0
2329,i feel its over .....,0
2330,thanks to everyone who listened to the radio show last night and apologies for the delay ( it was blocked by ubroadcast for a time ) .,0
2331,it 's * * * * in ' deadly !,0
2332,"yeah i downloaded them all just in case , have to wait until the all-in-one video gets posted again , seems the hews and their companies got to yt as usual and took it down ..",0
2333,is there a place where you can buy these ?,0
2334,why on earth are the swedish parents letting their kids grow up in an ethnic school !,1
2335,"now that the little troll is no longer going to nip at my pant 's leg , lets now look at the platform :",0
2336,hello direland2006 and welcome to sf .,0
