id,text,label
4141,"do s and don ts when stopped by police and carrying a firearm ( video ) by steve straub january 25 , 2014 do 's and do n'ts when stopped by police and carrying a firearm ( video ) - the federalist papers",0
4142,this is a picture of my youngest cat ( cheeto ) hanging out with my oldest dog ( nebbie ) .,0
4143,"sorry , i just do n't buy it .",0
4144,a small trace amounts of non white blood a few generations back can be removed naturally by generational mixing of more white blood into the lifeline of a family who 's great great so on on and so forth engaged in one incident of miscegenation .,0
4145,"in fact , this year this `` event '' is going to be this weekend .",0
4146,i grew up there but just moved to santa barbara for grad school .,0
4147,im not handing out candy this year personally .,0
4148,but that 's just a rumour,0
4149,do you think the writer of planet of the apes was trying to tell us something ? btw its a serious question .,0
4150,they can become some of the most anti-white people on earth .,0
4151,you sound like an intelligent person but how can you say that we need to remove race from our message when that is our message .,0
4152,ye i heard that one to. or ' we all came from africa any way so why dose it matter ' ........ my answer ? ' we evolved to be better',1
4153,it just goes to show that kids have more common sense than many white adults ( sadly. ),0
4154,disgusting .,0
4155,"instead of just telling the child that 2 + 2 = 4 because the math book said so , they could have put that into a ' problem ' and solution .",0
4156,well here we have it a white european team against a latin american team. we have done so well so far. that a white team has come this far is being considered as incredible by some. but since the next games are in germany2006 would n't it be wonderful if a northern european team won this !!! already i have read about german superiority rascist remarks. pamela leighas pallessen-scherehart,0
4157,i agree with your post except if its a white they will say so .,0
4158,big plans .,0
4159,the black race is yet to invent any kind of civilization .,1
4160,the sexual references are there .,0
4161,face shaved and moustache trimmed ...,0
4162,youtube - raw video : shoplifter uses skirt to hide booze,0
4163,"and i also hope that thing like that is not gonna happen with our brothers from belarus and ukraine , who are also working illegaly on construction jobs .",0
4164,online classes ?,0
4165,"her life was taken in her own home by intruders in a robbery attempt , who never gave a second thought to this child 's love of life .",0
4166,there will be a show in socal in early june .,0
4167,it is stupid as hell but it happens all the time .,0
4168,i respect them .,0
4169,but you get alot of american white nationalists or nazis claiming to want all non-white descendants out of america but america is not a native white continent or country .,0
4170,"as long as you do n't do that , they ca n't accuse you of misusing company time , or creating a hostile work environment",0
4171,it's wise to think in terms of `` 3 's '' when stocking up .,0
4172,with their age 's they enjoyed the one fish two fish red fish blue fish ..,0
4173,i think they will figure it out when the ratings start to slide .,0
4174,jewish supremicism is at the end of its noose. : madex,1
4175,got myself a pair of burgundy 8 hole grindres on a low sole they kick as as far as i am concernd thats all i need,0
4176,it 's an anti-white male thing .,0
4177,actually sxe kids are locked up more then drug users simply for acts of violence but maybe thats just here in utah,0
4178,enjoy your classroom .,0
4179,white person ! `` before hurrying to catch the ttc out of scarborough .,0
4180,the town where i live you could probably get away with it i have had mine on a few times and never had a problem,0
4181,i know something that will really turn them on and that they will absolutely love and is very useful for shutting them up :,0
4182,"i prefer classical music and marching band works , particularly the kind of score that was written for marching band , not some pop song transcribed to be played by instruments .",0
4183,sure sun media sucks off israel but they are also the only media that is willing to tell the truth about the dangers of islam and call natives on their b.s.,0
4184,the idea that homeschooled kids do n't get socialized is ludicrous .,0
4185,"rock music video for 12 stones band , with truck footage .",0
4186,many british do n't have the white nation mentality they see a foreigner is a foreigner is a foreigner .,0
4187,"i'd focus on the aspect of forced integration and that the whites acted in response to that , first .",0
4188,mrs. b 's anti gay messages are so important .,0
4189,"hell , the way we are deliberately poisoning ourselves i 'm surprised we have lasted this long !",0
4190,i am a 16yr old irish male dont worry lads i ll make sure ireland stays white and i hope i can count on help from my stormfront brothers around the world ???? 2508,0
4191,"since they are just little kids i do n't want to be rude , but how ugly is the black kid compared to the others ? it 's not even adorable , it 's kinda scary lol",1
4192,"amongst 60 millions french citizens , you would hardly find 5 millions french without foreign ancestry ( after 1900 ) .",0
4193,im looking for a good aryan white male in or around the central jersey or surrounding area or some new friends from all around,0
4194,"well i have changed my signature , i think it was stupid i was forced to do so just because some people dont like what i have to say , but i do hope my new one is acceptable. : attack",0
4195,"i keep telling people about things like this , and they never believe me .",0
4196,now there 's a medical advancement to think about .,0
4197,are executive orders constitutional ? | tenth amendment center blog -,0
4198,awesome.,0
4199,"more negro rioting , this time at a black panther party rally : youtube - nypd vs black people , ( macon st riot ) youtube - nbpp vs nypd",0
4200,"well , the warm weather is coming in and guess what , i now have to painstakingly endure all the offspring of these immigrants , africans , foeigners ( im putting them all because there is that many of them ) all playing out the front of the flats in the small garden area , screeching and shouting and their hyena pitched laughing .",1
4201,junior minister pat gallagher is at the centre of a garda investigation after the disappearance of nine bangladeshis .,0
4202,i have to say i was shocked when he said the kids at his ( junior ) school spoke 31 different languages and teachers have had to devise a system of hand signals to communicate !,0
4203,taurus judge buckshot ammo test : federal 410 handgun 000 vs 4 buck in ballistic gel - youtube 4.25 `` barrel : pretty devestating .,0
4204,"i found out 8 months ago , the negro currently resides in minnesota .",0
4205,"just in case anyone is interested , here 's the thread in the health & fitness section : `` eating fish makes you smarter '' along with another one in the homemaking section : `` fish oils and pregnancy and infants = health smart babies '' i think the scientific evidence for the benefits of fish is just overwhelming .",0
4206,the only problem i see in the area is a lack of outside work .,0
4207,"many years ago maybe , there 's no ammo for them anyway , rather send a donation of a few thousand m4 's",0
4208,go to the downunder section to read up on the news on how arabs got their asses kicked and even the police were running away in fear .,0
4209,all she needed was some attention and patience .,0
4210,"on thursday , a long beach jury once again found that jackson , now 52 , should be put to death .",0
4211,sounds like a good thing ....... i 'll pitch in for food .... but if we meet in a park or something like that .. somebody please .... do n't forget the beer permit ...... lol,0
4212,i 'm going off to college in about 6 months and i 'm wondering how you college guys prepared for it/payed for it. any tips ?,0
4213,hehe !,0
4214,as always the video is filled with the truth .,0
4215,- youtube angry large black woman goes ham on angry young black men - youtube white man cokes black man and than throws black man off and beat him up .,0
4216,as it 's very common among most animal species as well as just females are generally considered to be more necassary if you will .,0
4217,they blackmail shop-owners and give them protection so they claim .,0
4218,your gonna get beat up by guys ! thats messed not even the sorenyos kids at my school hit girls unless its their whore !,0
4219,daniel wretström march and their website : ( currently seems to be down but usually works just fine ),0
4220,"i have brown eyes , and would not trade them for any color .",0
4221,arthur kemp over exaggerates their role in almost every civilization .,0
4222,burlington coat factory hiring for new store in conroe | houston 's hiring | a chron.com blog lots more to check out .,0
4223,i seen the article we want to go to ireland get free money and goverment will give us houses and not one member of goverment says a peep expect residents against racism to take on their cause and the law system to make a mint off of them .,0
4224,- youtube welfare checks late - youtube,0
4225,"they need to feel it on their skin , so next time they wont give my land to the some subhuman muslim dogs .",1
4226,very funny .......,0
4227,"last i checked though , there are more europeans being raped by non europeans in europe than there have been in canada",0
4228,nothing so beautiful in the whole world in fact .,0
4229,the youth is not a internet thing .,0
4230,the flipside is those 70 % white students will do worse with `` teachers of color '' .,0
4231,thats pretty similar for me .,0
4232,hey there i just moved here to saskatoon and was hoping to hook up with some wn in the city here .,0
4233,been a dream of mine to visit iceland for years now .,0
4234,"if you are putting bread on a white family 's table , they will follow you .",0
4235,"interesting guy , if you 've never seen derren brown before .",0
4236,- youtube obama is going to pay for my gas and mortgage !!!,0
4237,amen brother ..... you did say it like you been there ... they talk crap and if you show fear they 'll be on ya fast .,0
4238,breastfeeding moms can throw the formula stuff away or give it to a shelter .,0
4239,seems like you cant get away from these parasites anymore its happening and getting worse everywhere .,1
4240,sword might come in handy for a couple silent kills or close quarters combat against lightly armed enemies .,0
4241,looked like it was 6 inches tall ; but i saw it .,0
4242,these things make me sick !,0
4243,"i have tears in my eyes from laughing so hard ... that was hilarious , theoden .",0
4244,while my mother has blond hair brown eye 's and my father brown hair blue eye 's and i inherited my brown hair blue eye 's from my father .,0
4245,youtube - a nation cannot survive treason : cicero f g are the enemy of the irish nation vote s f not the best but care for the working class irish not the rich scumbags .,0
4246,i dont know but becareful .,0
4247,brown eyes and brown hair make you no less white than someone with blonde hair and blue eyes .,0
4248,"i just want to see all the styles of clothes , how they wear them , etc .",0
4249,- pioneer little europe ( ple ) didnt anybody teach you ?,0
4250,also my college did not allow jews or homosexuals .,0
4251,"the name of the village was changed to dramastein , during the third reich , today it is called kamieniec in poland .",0
4252,dont let it get you down brother your not on your own just bite your tongue and think of all those beutiful aryan women who think the way we do they are worth fighting for everything enoch powell said came true. hang in there brother,0
4253,well i hate to tell that 40k will do a lot to help out the non-whites .,0
4254,ive never done it but heard its a great way to meet people ... although anglin is n't my favoriate `` white nationalist '' ...,0
4255,it was so great meeting all you guys last night i ca n't believe how many of us managed to hook up `` nearly the entire crew '' see you all in a few days ...,0
4256,so contributing and participating in any way to opportunities to instill pride in white ethnic heritage and even white american ethnic heritage will go a long way in helping them recognize what is being taken away .,0
4257,"i grew up in small town southern n.b for a good half of my life , in a region called kings county , it was 100 % white except for literally 3 black people , and they never mixed with whites ..",0
4258,however they had slavic names already after two generations showing that they were outnumbered and mixed with the local slav populations .,0
4259,hello!,0
4260,anyways if you wanna party respond .,0
4261,good for you !,0
4262,since you are new let me direct you to a site that also has good info and puts out a paper called the nationalist times .,0
4263,i understand this post is depressing .,0
4264,"it's not my responsibility to locate , isolate or else eliminate trolls at this site , nor do i wish to defend this person in any way .",0
4265,"that, or they were beat-ups in school and now they have badges , guns , and huge chips on their shoulders !",0
4266,"you can have a high i.q. and still have friends , i mean i ai n't a doctor or anything but i 've still got a decent i.q and i have like half my year as friends ( except all foreigners )",0
4267,capital d which promotes a multicultural dublin .,0
4268,her skin tone is not white to my eyes .,0
4269,how many yards were lost on that play ?,0
4270,the peepers are getting old ...,0
4271,"camden new jersey demographics : hispanic - 36,379 ( 47.0 % ) black alone - 34,277 ( 44.3 % ) white alone - 3,792 ( 4.9 % ) asian alone - 1,599 ( 2.1 % ) two or more races - 938 ( 1.2 % ) american indian alone - 235 ( 0.3 % ) other race alone - 109 ( 0.1 % ) native hawaiian and other pacific islander alone - 15 ( 0.02 % )",0
4272,even all or mostly white public schools will still feed poison agenda .,0
4273,maybe this was mentioned in an earlier post but what about `` online '' home schooling ?,0
4274,it is disgusting .,0
4275,will you marry me and be my eternal wife in this life and when we enter valhalla together ?,0
4276,i 'm looking for someone to train with .,0
4277,"cossack: there are no russians with hook nose and dark hair in russia , except for the jews .",0
4278,especially in the cariboo .,0
4279,88 - jim,0
4280,"i am 24 , like to hang out in my local bar have few ones and place music as much as i can .",0
4281,good to see more norwegians,0
4282,"it's not just blacks that fall after a good uppercut or direct to the chin , but these two are well fit for the blacks cause they have weaker chins than whites",0
4283,"i want to have 3 children ! 2 girls and 1 boy but the hardest part now is i got to try and find someone to make them with , but so far no luck",0
4284,"latha math dhuibh agus dè tha dol agad fhèin , a phàdruig/hello pat , how are you ?",0
4285,i support this 100 % !,0
4286,or just say as you remember it and i 'll say if it 's correct .,0
4287,grow a brain moron .,0
4288,merry christmas and happy yule !,0
4289,st. pats football teams fans use the st. patricks cross aswell as it being the symbol for the iru .,0
4290,western civilization month is a mouth full and many of them are too stupid to get it ( or just not paying attention ) .,0
4291,in england there are whole cities that are almost majority ethnic and hundreds of schools with no white children ...,0
4292,whenever i went anywhere little kids would come up to me and ask if i was hitler .,0
4293,around here their always shooting .,0
4294,thank god for the poles .,0
4295,lunch was surreal .,0
4296,especially brampton .,0
4297,as do blacks .,0
4298,"maybe you can bring bbq , i mean critter sauce ...",0
4299,`` my message to upa and bandera scum from a polish american small town politician from pennsylvania ....,0
4300,white guy murders asian student days before her wedding .,0
4301,assuming it 's not a public phone number i 'd put adverts in phone boxes saying he takes it up the bum for a tenner .,0
4302,"you know , wheat and corn grow pretty fast .",0
4303,dumb goyim are a good revenue source .,0
4304,fathers of sweden watch out for your daughters ' safety !,0
4305,like cats for example .,0
4306,all i have to say is none of this crap that is happening in the world is going to change unless people on a large scale actually stand up and say no we have had enough and drag the scum in the streets and deal with them in a most violent way .,1
4307,scientists portray neanderthals as whites because they 're politically correct and scientifically incorrect .,0
4308,the ' civilization ' series narrated by kenneth clark is free on youtube .,0
4309,hello my name is shane i live in eka i like to surf talk be around kids enjoy people the arts have fun camp fish love my mom have a few close friends but a big support system i go to cr its good i like it also if you need more write me back,0
4310,- youtube judge with pdx 1 ammo - youtube long barrel : 000 buck is devestating .,0
4311,god rest this man 's soul .,0
4312,"so , i do n't know what to say .",0
4313,five is about what i 've found also .,0
4314,don't that just suck ??,0
4315,they know what happened or not .,0
4316,the problem arises is that the same whites who will march for black pride will call a white march racist .,0
4317,"let me make it clear i do not like muslims but they are still slavs so they are my brothers , as long as they keep the religion to themselves then there is no problem for me .",0
4318,we are not a criminal organization and there is no place for criminals in the klan .,0
4319,they way my mom found out was by my negro loving sister and my sister found out because a black racist bus driver started to call my sister and her friends racial names so i said i would get some of my friends and we would go on that bus to ``make a statement`` and she told .,0
4320,i sent in my application a few days ago and was curious .,0
4321,"sure, send me an im on goodreads or here telling me your goodreads id so i can invite you to join it .",0
4322,ok i 'll do that when i get back from picking him up from school .,0
4323,even if that someone openly uses their own name .,0
4324,: // / it 's a lesson for children .,0
4325,a : 60 feet q : johnny 's team had the football on the 50 yard line .,0
4326,i have yet to see a half breed that came out dominantly white .,0
4327,- youtube magyar hadsereg bevonulása erdélybe kolozsvári dísszemle 1940 hungarian amry in transylvania - youtube 1941 hungarian troops enter the ukraine - youtube my great grandfather fought in the hungarian army during ww2 .,0
4328,the pourpose of this post is not to promote an islamic ireland .,0
4329,i've used firefox for over a year now .,0
4330,but maybe it was just him .,0
4331,"if you were smart you wouldnt create a white pride school group , take it from someone who has been through it .",0
4332,evangel n .,0
4333,as i say iam active in another party and their meeting was where i live so i thought i would turn up .,0
4334,"the white race will soon be on the brink of being a minority in a few years if nothing is done to stop these vile hordes invading our lands , i for one do not want to live in a city like bradford or birmingham where we are outnumbered 2 to 1 or worse",1
4335,it 's the ideal way to raise boys into men .,0
4336,wwii was always a favorite subject .,0
4337,few more pictures from slovenia : // ... & postcount = 196 : // ... & postcount = 197 : // ... & postcount = 206 : // ... & postcount = 207,0
4338,officers took 37-year-old charlie cason into custody after a violent exchange .,0
4339,i can tell you right now if a black mob is threatening my life and burning my town i 'm going to start shooting .,1
4340,unfortunately chicago doesnt prove this .. we need to send them all to the poles we could make better use of africa,1
4341,been lurking around for far too long and felt it was high time i got my bum signed up in the hope of finding other active and like minded folk close to home .,0
4342,"africans are tall , thin and lanky and pretty ugly beasts . ... and i 'm just being kind .",1
4343,"i 've seen university of cape town 's website and checked how many white students they have , about 40 % .",0
4344,there is no requirement of circumcision found in the nt .,0
4345,"hey, no matter what his faults may be , he 's presenting something to the mainstream american public that nobody else is presenting ...",0
4346,kurds in berlin : germany : watch thousands of kurdish protesters rally in berlin - youtube and hamburg : germany : see hamburg swamped in anti-is global action day - youtube munich : zwei zwillings-paare kommen munter und gesund zur welt - mã 1\/4 nchen - bild.de,0
4347,why dont you move to nebraska ?,0
4348,man that sucks lol ...,0
4349,axis history factbook : waffen ss-grenadier-sturmbrigade brigade frankreich - french volunteers and collaborationist forces amazon.com : for europe : the french volunteers of the waffen-ss ( 9781874622680 ) : robert forbes : books amazon.com : for europe : the french volunteers of the waffen-ss ( 9781874622680 ) : robert forbes : books ... ss- ( rk ) -holder,0
4350,"? artid = 222065 suspected for warcrimes , seeks asylum in norway a chechen ( 32 ) - wanted for warcrimes - and a lebanese ( 41 ) - suspected of warcrimes - lives at an asylum reception center in norway with their families .",0
4351,just google it and you 'll see what i mean .,0
4352,"on the basis of this and the pm 's forwarded to me , you will take a week off to calm down .",0
4353,"the bodies of dead goats , geese , sheep , and ducks had also been discovered "" .",0
4354,i see manialy blood and honour use it .,0
4355,: // ? v = 3rnrphewelo & index = 2 & list = fl3k6cf7xgpkj02higvcjfcq,0
4356,does you do n't know anything about that person except what they themselves have chosen to tell sound familiar ?,0
4357,there's so many good choices it 's hard to pick just one all time favorite .,0
4358,where are there morals ?,0
4359,like this [ img ] documents and settingsblueguardskrivebordny bitmapbillede.jpg [ /img ],0
4360,now .,0
4361,i'm planning on being in ireland within the next year .,0
4362,"hello takebakamer1211 you are not typing to yourself , we can all see your message .",0
4363,our family members are often the hardest people for us to reach but the most worth it when we do .,0
4364,whites hide in their all white cities towns neighborhoods etc .,0
4365,"a group of american men in the late 1700s decided they could defend themselves against the government of england , but it was illegal to do so .",0
4366,will be able to elect our own mayor soon .,0
4367,right in the mainstream .,0
4368,you have to check around to see what is avaialble in your area within your desired field of study .,0
4369,what city do you live in ?,0
4370,"i dont think anyone is going to decide , its going to be where whites feel the most at home among their own .",0
4371,"we've had a couple of similar cases in finland , when a nig purposefully tried to give dozens of finnish women hiv/aids .",1
4372,you tube you tube you tube you tube you tube im sorry im joking this is so funny,0
4373,"cool, but he is short with his draw , and the draw weight looks light too .",0
4374,i have a feeling though that propaganda photos like these will have the reverse of the desired effect .,0
4375,i got 6a 's and 4 b 's .,0
4376,yes i have seen african blacks driving those type of cars too .,0
4377,no but i was typing fast and must 've pushed shift too early ( since you need to push shift to use the ? symbol ),0
4378,let alone 6 of them .,0
4379,but evertime they took their arms out of water the burning immediately started .,0
4380,maybe you 'll find it useful .,0
4381,"`` would you , would you with a goat ? ''",0
4382,nearly everything if not all acts that the liberals carry out damage this nation and our people .,1
4383,"i am a new member from bronx , new york looking for new friends to talk to .",0
4384,often they have rosy cheeks as well .,0
4385,hungary must stick to its guns it is a sad day when sticking to ones guns means simply enforcing the law as proscribed,0
4386,so... you would say to lie .,0
4387,living well is the best revenge .,0
4388,the comments section for this article is pretty empty right now ...,0
4389,i have several ruger revolvers in .357 ( including my carry gun ) and i thought i 'd try something new .,0
4390,i figured it would only get worst .,0
4391,"during the early punk scene , he was always seen decked out in a union flag blazer , then all a sudden , an instant nationality transplant .",0
4392,"you can take a negro out of africa and have it grow up in boston and orlando , and it still reverts to its innate negro ways the moment it hits its native african soil .",1
4393,i expect there will be half a dozen posters getting up on their soapboxes awful quickly ...,0
4394,stay for gel test .,0
4395,sorry that you were unaware .,0
4396,"welcome back , i hope you make s/f a habit .",0
4397,such a shame that our government cares more about looking good in front the world then it does about the safty of its people .,0
4398,our country is being over run and people let it happen just because the political issue here seens to take over the racial one .,0
4399,it might hold together for a short time but eventually major problems will develop .,0
4400,yeah if i can get time off work for it .,0
4401,"i got the message you were trying to get across in your first post , i just felt like messing with you .",0
4402,travel abroad ( something i have never done ! ) 5 .,0
4403,"einstein said nothing can go faster than the speed of light , then squares the speed of light in e = mc ^ 2 .",0
