id,text,label
0,from what i know they 're almost exclusively nigerian asylum seekers .,0
1,5 months break divided during the year .,0
2,"it 's a nationalist site as well , maybe give them a try !",0
3,"too many internet people know me by looks , and would love to crucify me for something .",0
4,i read an article on that awhile ago and it said that when eisenhower went to moscow he did n't even ask for american pows to be released .,0
5,i bet this negro is planning for an insanity defense and he may just get it .,0
6,"a powerful gang member who may not rape , may sell a new prisoner to someone that does .",0
7,every one stop making fun of other people 's pic 's were all a white family.by the way all you lady 's on here are looking fine to bad i 'm only 16 .,0
8,i want to know where did celtic nation found this picture : just two girls looks to be portuguese .,0
9,"apparently he came to the conclusion that his french was too poor to win over quebec , and thus he felt destined to lose .",0
10,viva la mayheeko !,0
11,"i just recently quit smoking cigarettes ( very hard stuff ) and i will say i do like to get together with a few friends and have a few beers , but that 's all i 'll do .",0
12,"so long as exists i will not only think of blacks as sub-human savage beasts with no more self-control than a rabid dog , but refer to them as such .",1
13,"i like this video : die antwoord - `` fatty boom boom '' ( official video ) - youtube girl dresses in blackface , shows africa is savage , and makes fun of lady gaga .",0
14,hungary in ww2 : for the justice !!!,0
15,definitely going to stock up on certain melee weapons for the future .,0
16,a couple of white woman who speak the full truth and name the jew !,0
17,`` can you tell me where this service is ?,0
18,i sat up with my eldest son till 5 am to watch a fight that went 14 secs .,0
19,thanks it may not seem like much but just puting one of those leaflets up on a noticeboard gets a lot of people talking .,0
20,read what is in bold .,0
21,seemed to work well on the indians and australian aborigines .,0
22,"tesco shoppers in mold , flintshire flee man wielding machete | daily mail online edit : sorry i just saw this has already been posted .",0
23,to which one should reply that they are a bunch of soft bellied women of whom their ancestors would be ashamed .,0
24,oberschlesien - als die deutschen weg waren ( 4/5 ) - youtube,0
25,oh that 's just great .,0
26,"`` oh s * * t , '' without looking , `` i hit one of their cars and now i am going to die ! '' , but to my relief , it was merely a light pole .",0
27,at least people in the us have guns to defend themselves .,0
28,the indians and stanis will just spit all over the street .,1
29,in this text there is a table of how they are going to destroy our culture and implement their communist state .,0
30,thanks for the tip rock does not really macth my taste but i 'll go check it out anyway who knows,0
31,as far as i know there is no russophobia in belarus .,0
32,the only thing holding us back are our traitors and the 40billion anti-european people of the earth that flourished on our technology .,0
33,"it is like they would bleach their hair blonde and bleach their skin `` white '' , speak english , etc but still they would torment others with their black characteristics .",1
34,"allow me to apologize for my last post , as i was drinking heavily last night but you callin me a genetic lottery winner ? come on now i 've had my fair share of hard times just last week a yellow person came into my place of work and started making trouble .",1
35,break them up .,1
36,the folk im talking about have been shoulder to shoulder with me for a long time and i will continue to show loyalty and respect to them as they have more than earned it 828,0
37,leave now .,0
38,he live on forums all day because he have no job .,0
39,tight as in good pals ?,0
40,nationalists attend rally for life 2013 - youtube,0
41,i had never even heard of stormfront until the night i found it and joined .,0
42,don't think you supremacists would ever be able to build up the force of resistance that irish republicans did mate .,0
43,i cant say i have ever saw a c in a on any products i have looked at .,0
44,we might as well just abandon the land because people invaded the land and took it from the animals .,0
45,"also some of us on here , like myself , do not believe in the genocide of another race which is what abortion is doing to the black race as 92 % of abortion clinics are in black communities , we just do n't believe in race mixing .",1
46,a few years back my son had a english teacher that was from south america that couldnt hardly speak english yet she was teaching it,0
47,dyeing your hair is the right thing to do. : attack go and run me over a * * * * * *,0
48,few pics taken this summer ...,0
49,they were nothing short of a godsend .,0
50,"dont quote me on it , im pretty sure open carry of a long gun in texas is legal .",0
51,hope fully `` next year in jerusalem '' as they say .,0
52,they do n't have capitalism there !,0
53,see the new thread @ : //,0
54,just take a few correspondance courses if you can you can likely make up the credits .,0
55,"ireland joins international task force on holocaust education , remembrance and research ireland has been accepted as a member country of the international task force on holocaust education , remembrance and research ( itf ) .",0
56,wasn't there something like a big bang in which a burrito exploded and all the beans flew everywhere and started reproducing exponentially ?,1
57,"yeah , it 's expensive .",0
58,i hope all goes well in sweden ( i lived there ) and loved it .,0
59,"i dont mean with kids that young , you are doing the right thing with them.but an extreme approach works with teenagers",0
60,hello to all my friends here on the forum .,0
61,i had to get used to her looking like that because she looked so obviously fake .,0
62,blacks are n't that strong .,0
63,thank you for your post .,0
64,careful what you laugh at .,0
65,i have bookmarked the site and will check up on it often .,0
66,"this lady came out of a convenience store and got the stare , she glared right at them , spat on the ground and stormed off !",0
67,home schooling is the best option .,0
68,i have no clue what it does but its there lol .,0
69,"i posted a thread in stormfront ireland the week before about english hooligans slashing an irish mans throat , the thread dissappeared without explanation .",0
70,my kids in school are only around kids born within a few months of them and they rarely get to talk .,0
71,that prince who married that asian is a freak. imagine his half and half kids growing up and trying to marry into other royal families,1
72,blacks built the pyramids and the white house .,0
73,nice to see you on this board mo. i posted a thread on this a week or so ago and here it is .,0
74,to be honest .. it frightens the living hell outta me .,0
75,"we all have unique abilities and knowledge , can you imagine if we got together and each of us put together a class for all the children in our specialized field ?",0
76,"such as a person with one arm , wheel chair ect .",0
77,if whites did have some knowledge and a little more recognition was put out there i think most of them would feel a little more pride of who they are and stick to the white race .,0
78,imagine that someone tells that it 's your fault because you provoked russians or some similar idiotic bullcrap .,0
79,"welcome to stormfront , the largest white nationalist community on the web .",0
80,i found out this morning that junior school kids are n't allowed to sing bar bar black sheep anymore because it 's racist and might offend the coloured kids so they are being told to sing bar bar randow sheep ! whats next we 'll not be allowed to sing god save the queen .,0
81,some klansmen refuse to see where real problems are .,0
82,he will get aids soon and die,0
83,i think they are just desperately trying to be more popish than the pope himself and avoid accusations of racism before they are even expressed by demanding increased immigration .,0
84,i ca n't fathom seeing all those brainless whites along with their negro counterparts worshipping obama .,1
85,uc student robbed at gunpoint : ' it can happen to anybody',0
86,as a brit my knowledge of american law is somewhat lacking but even i know that this holder groid has committed treason,1
87,imagine this as a pro romney video with ted nugent in a black family 's home screaming at them to wake the bleep up .,0
88,"that kid is probably going to get some disease from laying with his face on the floor of a supermarket like that , or some good doer will call he cops and he could get put in a foster home .",0
89,wiggah 's are created when they ca n't import the genuine black .,0
90,i then checked miss portugal .,0
91,how can they do well at anything that requires logic when they are required to accept that a and b are equal ?,0
92,i shall contribute to this organization and support the xxv points .,0
93,dont screw your life up because of some stupid little fight by using a weapon .,0
94,the day i chose to have a child i hope there will be many other schools like this across north america .,0
95,i'm young and viciously angry i 'm not going to lie or apologize for my actions i treat non whites like utter crap and i always have and always will they are n't human in my eyes anyone who tries to wipe out my race and culture will be met by hostility by me any race who rape and abuse their and my women will be met by hostility and contempt by me wpww,1
96,i got so sick and tired of all these idiots who think jacob zuma is the problem that i decided to hold up a mirror instead .,0
97,i 've always wanted a log cabin though .,0
98,what is you teaching schedule like ?,0
99,in the next few weeks i 'm planning to buy a rifle in .308 win/7.62nato.,0
100,what educational goals or philosophies influence what curricula you pick ?,0
101,youtube - black savages bake puppy alive !!,0
102,"not just that , but many people who adopt kids are capable of making their own pure white children .",0
103,i've been going through your youtube channel and while i dont have a taste for opera may i say that you have an immaculate ear for music. really enjoyed the hans zimmer piece .,0
104,"race mixing is and has been a huge problem for of kin for many many years , how on earth are you supposed to protect women who think its ok in the first place ?",0
105,just my opinion .,0
106,well done to all the people in ireland.let 's hope this is just the start of people waking up to the dangers of a mulitracial society .,0
107,"however , in per-capita rates , u.s. legal immigration is at about 3 per 1,000 annually , while for canada it 's about 7 .",0
108,i doubt it though .,0
109,"i enjoy outdoor sports , although i never went fishing before .",0
110,cohen is shameless .,0
111,i think this would just be a tighter grip the zog would have on us .,1
112,i would allow them to fall away out of my life and i would never look back .,0
113,that was over 30 years ago .,0
114,"it's probably a combination of the sexual tastes of homosexuals ( toward the adolescent ) in the agency , and the racial agenda of liberals in the agency .",1
115,for analogy : you put feces in your soup you put water in your cars gasoline tank you feed your livestock poison you water your plants with salty water giving your kids fas you do n't need to punish these people .,0
116,thanks for the tip // lila,0
117,some of them claim that they would like to go back home one day but after a few years in finland they will no longer have this wish .,0
118,feel free to point out the intelligence in your claim that germans have achieved nothing .,0
119,this is why i need something else then that .,0
120,i'm pretty sure its not legal to pull someone over for out of state plats but living in tn for the past 5 years i see it all the time .,0
121,we will proof read it and send along suggestions .,0
122,rest in peace herr hess .,0
123,it is always about divide and conquer.if you look at the golden dawn pictures they usually have women around there.unity among whites is a must between the sexes .,0
124,aren't u tired of ur propaganda ??,0
125,"if you 're not prepared to make the effort of holding faith in ireland 's future , you should leave this board .",0
126,"according to mathieson 2015 , they had around a 30 % incidence of blue eyes ( versus around 25 % for the steppe populations ) and carried the same mutations for light skin that the steppe people did .",0
127,"i use 40mm grenade ammo cans , rubber sealed and air tight and you can find them for about $ 20 a piece .",0
128,everyone keep on spreading dr. dukes videos around the internet and we will soon win the war .,0
129,keep russia free from dark skinned beings !!!! thank you and please forgive me for mistakes .,1
130,5 years later we split up .,0
131,so toronto police are investigating a `` racist '' `` alt-right '' poster found on a telephone poll near a school .,0
132,thankyou all for allowing me to vent as i feel so angry .......,0
133,"what are the best ways to start you own white community , set up your own currency or other methods of trade with other white communities in order to support your white community ?",0
134,"i think i heard that sweden and norway have mtv now , do finland or the baltic states get that garbage yet ?",0
135,i hope they continue .,0
136,any suggestions on what i should get ?,0
137,ive been lucky enough for that never to have happened .,0
138,"we just recently visited a relative in london .. lord god , 2011 london is nothing like the 1950 's london i spent holidays in as a wee kid .",0
139,im on youtube trying to find it right now .,0
140,travel through the usa 5 .,0
141,owners at bars dont even look at just have bartenders place on bar .,0
142,"i didnt say they 'd run but race mixing will eventually take over and america will be majority black or mixed race , whites will be in the minority except for in certain republican nationalist areas",0
143,there is nothing patriotic in acting like a nagger .,0
144,i like both of these genres and will have to put lovecraft on my list of authors/books to read .,0
145,"i never really thought about it before but i guess bicycling is primarily a white activity , kind of like sunbathing , going swimming , playing golf , tennis , attending a social function without a brawl taking place , not smelling like a wild animal in the locker room after a hard workout , and speaking proper english .",1
146,very great pictures everyone !,0
147,"we have to encourage people to boycott all black businesses , start rumours that blacks working in shops have aids which is probably true .",1
148,at this point i will assume the media is lying about everything other than a negro being arrested for his murder .,1
149,there is no good in reasoning a bitch that is hungry for a dick.forget her and let her perish in shame after negroid kicks her after a few tries .,1
150,"like its cousin in astrophysical waters the crab nebula supernova remnant , the jellyfish nebula is known to harbor a neutron star , the remnant of the collapsed stellar core .",0
151,i want to wish all students here and everywhere else the best of luck on your mid-terms .,0
152,hitler was about as jewish as a negro is a chinaman .,0
153,get the hell out of there as soon as possible .,0
154,i have no idea why they always have to fight each other when there are more important things they should do .,0
155,virtually all of those rapes are committed by non-whites .,0
156,the only bad thing is that these sick animals will infect whites .,1
157,i know much about that event because i was in that crowd that day in 2010 .,0
158,lemme know if you are from ohio and maybe we could meet up and chat .,0
159,it 's all about race mixing .,0
160,the `` missing '' and the photo of the young girl is an attention grabber put it up around schools and playgrounds .,0
161,jews have white skin does that make them white ?,0
162,"i think i will post one , i placed my profile on eurodate a few days ago .",0
163,it's best to ignore individuals like that .,0
164,it ai n't right unless it 's white .,1
165,-sending their kids to jewish summer camps .,0
166,is this the one who broke out of six different concentration camps as a child and swam 200 miles upstream in the icy danube river ?,0
167,ill shave my head when i finally get my 5 gcse grades at c or above .,0
168,spread the link everywhere in public and in internet !,0
169,"this is the previous edition of that textbook `` making europe '' amazon.com : making europe : people , politics , and culture since 1300 ( 9780618004829 ) : frank l. kidner , maria bucur , ralph mathisen , sally mckee , theodore r. weeks : books amazon.com : making europe : people , politics , and culture since 1300 ( 9780618004829 ) : frank l. kidner , maria bucur , ralph mathisen , sally mckee , theodore r. weeks : books when you click on the picture to `` look inside '' the negro pops up .",0
170,this way they can come over here dragging their knuckles to fling their feces at us and call us racists .,0
171,then how come the only ones they arrested in connection with those attacks were active fsb agents ?,0
172,what are you using this school year ?,0
173,these are the indians that i know .,0
174,"i could give a course on gun safety so , that they do n't end up like that monkey that shot off his penis .",0
175,we should be able to have guns in the uk most of the criminals have them so why not we need to protect ourselfs as well !,0
176,i am so tired of it .,0
177,guess you must have forgotten engles from lack of use try it is espagnol !,0
178,london is not the place to move to as a white nationalist .,0
179,i do n't want to throw my life away .,0
180,"has been in the wife 's family since it was brand new , original owner used it until the stock split and the checkering was worn down to faint traces on the wood surface .",0
181,"i'm from a place of 20 ' 000 and it 's 97 % white , come white people !",0
182,"those same documents also revealed that there were only 360,000 inmates ever in auschwitz , total , from the time it opened until it closed .",0
183,how can anyone teach or discuss past events leaving out a race people responsible for the majority of strife amongst europeans .,0
184,maybe i 'll watch for an hour or so the few times a year i 'm travelling and stay in a hotel .,0
185,2 ) lethargic [ syn. inactive ],0
186,i 'm 20 and in vancouver .,0
187,? feature ... v = trlwaksmkha# !,0
188,saw that youtube video of those guys shooting 444 marlin and 454 casull in an old 410 shotgun .,0
189,"btw im led to believe that football [ soccer ] was invented in somalia , in about 1066 ad .",0
190,though i can see it happening someday soon by the state of the rest of the uk .,0
191,"so far as i have seen , it has n't .",0
192,i'm not sure if you all have heard of this before or not but the other day my friend told me that he heard soon the government will require us to have an id chip put under our skin on our hand .,0
193,facebook account helps me fo example if im not present in school .,0
194,the only thing that they care about is welfare and mooching of all the rest of us .,1
195,stuff like that needs to be shared on facebook to wake canadians up .,0
196,"if you have children or grandchildren ages 12-17 , please encourage them to learn about their heritage and history this summer by enrolling in the knights party crusaders youth corps through : youth corp",0
197,i never let my kids drink store bought cow 's milk because of the massive amount of stuff they give diary cows to up the milk output .,0
198,can we count you in ?,0
199,i have read it three times and find it very interesting .,0
200,texas marine dies defending his wife in french quarter he was fatally stabbed after a formal marine corps ball marines mourn sergeant stabbed in french quarter | national | chron.com - houston chronicle,0
201,"seriously , go somewhere else and have someone else throw a pity party for you .",0
202,sun releases massive solar flare - nasa video - youtube slideshow from cnn huge solar flares light up for nasa cameras - cnn.com could solar flare on friday the 13th knock out phones and gps devices ? | mail online,0
203,"1. morbidly melancholy , 2. irritable ; bad-tempered ; splenetic .",0
204,my scientist can beat the living life out of your scientist on any day .,0
205,"idiots like you fail to last when surrounded by your pets , the name of your alleged savior will be on your lips as you get `` diversified ''",0
206,they can kiss their n.b.a. careers goodbye .,0
207,people suffer more the closer they are to ground zero .,0
208,good grief !,0
209,i have a .40 sub compact and a .40 xdm .,0
210,and greetings to you as well brother .,0
211,blood and honour is a world wide white organisation .,0
212,the song comfortably numb is from pink floyd .,0
213,i also want to say you have a great website .,0
214,same with basketball and baseball .,0
215,"and yes , they will steal anything from whites because they think whites owe them something , so it 's ok to steal .",1
216,i 've taught her to question everything that they teach her .,0
217,the work involves : selling sporting goods and assisting customers with questions or problems .,0
218,do you have any figures on this ?,0
219,the person who does that will also make history in his or her field .,0
220,i dont know birmingham but generally the best places to go for a haircut are up market and more importantly old fashioned hotels .,0
221,"larger fish eat smaller fish and with each step of ' the big eating small , ' as you go up the chain , any mercury becomes more concentrated , thus the larger the fish , the more chance they will have some mercury in them .",0
222,in a 72 hour scenario you dont need food .,0
223,i hear that and i have heard of using wasp spray .,0
224,"- youtube magyar királyi honvédség - holding out for a hero / egy h wehrmacht , ss and hungarian troops - 1944 , carpathian front ( hq ) , 2.1 .",0
225,this thread makes me thankful that i will be homeschooling my children .,0
226,"many asians will see something once and memorize it the rest of their lives , but when asked ' how ' it works or use it creatively , they draw a blank .",1
227,thanks for the good stuff on here to show my kids .,0
228,wow!!!,0
229,can someone tell me when i can find any mp3 of cebephibe bpata ?,0
230,"factory nickel , with carved pearl grip scales .",0
231,or was that just a media run ...,0
232,"my wife and i both support the idea , so i have been looking for information on the internet and came across this census map from 1990 .",0
233,"migrants living in fear after racist bomb attack on poles - northern ireland , local & national - belfasttelegraph.co.uk they 're threatening to leave , we 're doomed !!!",1
234,lol ( obviously not 90s .. but it would be 50 up here and 30 in florida .,0
235,"[quote=trotis;10497843]isn't south african chocolate made by overseas companies based in sa ? ( british and swiss ) would a `` mars bar '' taste different made in sa compared to one in england ? / quote ] i would have thought so too , but the stuff tastes different .",0
236,i sent out a few more emails the other day and then last night handed out about 25 or so leaflets made up of david duke 's talk on this and the duke lacrosse case that the st. louis volksfront donated me .,0
237,"i honestly believe that folks are s l o w l y getting wise , and fed up with this `` sea hags '' crap .",0
238,"whats the difference between st. patrcks day , and martin luther king day ? ........................... on st. patricks day every body wishes they are irish .",0
239,most white kids i know believe they are superior and they freak out whenever a black guy is fighting a white .,0
240,id say move out west were ever either b.c or alberta all white people in canada need to move out west so we can take the west back .,0
241,this is purely verbal rhetoric ie there is no argument to speak of in the text of this gibberish .,0
242,it is a wonder that no scientist has thought it an amazing resemblance and wanted to do more tests .,0
243,"because illyrian-celt tribes ( dalmatie , japods etc ) lived on present day croatia , then the slavic croats arrived and assimilated those illyrian-celts , and on end we have germanic influx during frankish empire , holy roman empire , austro-hungarian empire and ww1 + ww2 period .",0
244,"i suppose the concept of a male cow and a female cow producing more cows , and the repeating process is too much for them to understand .",1
245,there is a 911 section .,0
246,lol.,0
247,"take a look at the posts in this tread , its shameful that this is what we have become .",0
248,custom carbine ar ( one of mine will do ) 2 .,0
249,nothing in it 's lyrics are .,0
250,about those training : i never realized they had all that equipment .,0
251,yeah they did this crap at my school when i was in kindergarten .,0
252,now there practically giving ireland away .,0
253,law & disorder : ' missing ' toddler found in gym bag jacksonville police looking for a missing toddler found the child alive but stuffed in a gym bag locked in the back of a car .,0
254,savage .300 mag .,0
255,"in another version ( hardcopy , photocopy from a 2009 ) it read power , position , and privilege , and now it reads power , presence , and privilege .",0
256,this is hate !!,0
257,more please .,0
258,you can also try this online education directory to find out a good rated online school .,0
259,i 've seen guys lose to girls and have their high school lives ruined to the point of having to switch schools because of the teasing and tormenting after losing to a girl .,0
260,vox was a romantic .,0
261,these ' niggas ' .,1
262,supporting our men and women in the armed forces .,0
