id,text,label
6003,"i caught this on youtube , i 'm sure someone has posted this at some point on here but it deserves reiteration .",0
6004,he should sue for racism .,0
6005,com/watch ? v = krdycxpb4fs and then the entire myron fagan video @ youtube .,0
6006,cz-75 tactical sports ( 9 mm ) mossberg shotgun ( 12 gauge ) finnish rk 95 tp ( 7.62x39 ) m14 with scope ( 7.62x51 ) h & k 416 ( 5.56x45 ) i sort of regret not being able to pick the aks-74 carbine as my sixth .,0
6007,no tv ...,0
6008,i urge all white nationalist in this area to do the same .,0
6009,hey waterfall what if a mulatto looked white and claimed to be all for the survival of the white race ?,0
6010,"but unfortunately , maine 's become the dumping ground for somalis and other african trash .",1
6011,"cross-dressing is in , could try that !",0
6012,crap like that is all so common these days .,0
6013,wonder if food stamps would cover s * * t for them in america and we could not have a food shortage of real food ?,0
6014,guess it could be .,0
6015,'according to okayafrica.com ' : ' a violent scene unfolded monday at the university of the free state in south africa when black students and workers disrupting a rugby match were attacked by white students .,0
6016,short barrel 45 feet : taurus judge with winchester pdx1 loads - youtube short barrel 30 feet : taurus judge 000 buckshot/.45lc tests at a life size target .,0
6017,is that sign like passop ? danger .,0
6018,"exactly, they want us to lay down and die .",1
6019,"drm radio will be broadcasting it 's second show , live this coming thursday the 23rd dec , 8pm to 10pm on listeners to the show are welcome to send us material they would like to have read on-air during any of our live broadcasts .",0
6020,slidesong : bob rivers comedy corp - the twelve pains of christmas - youtube do n't miss the 8th day of christmas at around 1 : 40,0
6021,"1. good news , especially that of the gospel [ < a.s. god spel , good tidings ] ; 2. one who carries the gospel news ; an evangelist : evangel , archaic , any one of the four gospels. [ < gk. euaggelion , the gospel < eu , well + aggellos , a messenger ]",0
6022,you 've managed to do the total opposite and created meaningless arguments that will get us nowhere .,0
6023,too bad 98 percent of public school kids are being taught everything but the truth .,0
6024,a 750 lb boat with a 280 hp motor .,0
6025,i was in the taiwan airport and the whole plane was east indian .,0
6026,i'd love to hang out with anyone since there 's very few white nationalists here if any one wants to please pm because i really need some people to hang out with,0
6027,most enlightening .,0
6028,why yes you should !,0
6029,a people of strength always honour their true heroes .,0
6030,": // ? fref = ts here you can see various phenotypes of white members of that group , with purely european faces",0
6031,"you now have a new friend from pembroke pines , florida .",0
6032,one night stands are wonderful when you know you dont want anything else from anyone on the continent .,0
6033,why do you feel a need to talk about this publicly ?,0
6034,i hate the dramas and bull * * * * like this .,0
6035,i plan to work donig that for a few years then it 's off to med school .,0
6036,only thing now is they have to go get their skin dyed .,0
6037,you 're beautiful !,0
6038,"they must have trapped her somehow , and sent her thru the network to israel .",1
6039,may the gods and goddesses watch over you both !,0
6040,"an ar10 is a weapon that 9/10 of those who own , myself included , do not have even half the range time or training with to actually use to it 's capabilities .",0
6041,"i believe , judging from your other posts , that you belong more towards the back .",0
6042,take care .,0
6043,"first there 's rations : food you 'll need , water you 'll need , ways to get food along the way ( guns and ammo , fishing lines , traps , nets , etc ) , and ways to get water ( containers , purification tablets , filters , etc ) .",0
6044,"whites are far too comfortable over here ; every night is party night , so to speak .",0
6045,"nothing more than a murdered white girl , the talking heads could care less about her .",0
6046,the jews of today have only been a `` race '' since about 1000 ad called jews .,0
6047,we ca n't afford to lose you .,0
6048,"this coming week , i will be sliding hundreds of these fliers under the windshield wipers of cars in the mall parking lots in the houston area .",0
6049,wow ..,0
6050,little kids all decked out in their costumes .,0
6051,"it makes my skin crawl to hear her drunkenly yelling at her kids about how much she hates them and their father , using every racial epithet i 've ever heard .",0
6052,this looks really good peachy .,0
6053,"i do n't have much to add that have n't been said , but i would like to say welcome garmgormius !",0
6054,take back what you said or i will report you .,0
6055,"there you go , its okay now , sshh .",0
6056,does this not show how stupid these folks can be ?,0
6057,i twice went to their concert in the olympic stadium in moscow - in 2010 and 2012 .,0
6058,"for all of liberals ' ranting about tribalism , they behave in a very tribal manner themselves .",1
6059,theres an old style weapon called a monkeys claw/fist that seamen would make from rope and lead shot .,0
6060,m & p vtac 45 5 .,0
6061,i am not having my cats put in a pet cemetary-they 're being interred in the same plot as i.naturally we will probably not pass on at the same time but we 'll be sharing the plot .,0
6062,over a million whites have left south africa since the communist anc government came to power .,0
6063,from norway to the fareo islands and then onto iceland .,0
6064,sergey brin claims his family were victims of `` anti-semitism . '',0
6065,i 'm beginning to wonder with all your posts defending the greatest race-traitor and puppet-of-jewry that great britain has ever produced .,1
6066,major chimp-out at hip hop awards .,1
6067,"this means you belong in mexico , not the us .",0
6068,and so friendly too .,0
6069,why would gooks want to look white ?,0
6070,we all want the females that are smart and look like top model but imporant is to ask ourselves : do we deserve ?,0
6071,"back of a bus on a truth or dare when i was in high school , when a moment seem to last forever .",0
6072,"i'm not in the chicago area , but i do know some people in the chicago area .",0
6073,oh i 'm not worried about it .,0
6074,88..im from houston and hoping to get a few others to go from austin also ... if there is anyone needing a ride from houston they can message me on yahoo .. under cherrybyrd88 ...,0
6075,"very nice i have a problem with clutter in my room , i would need to throw a hell of a lot out to make mine over but good job",0
6076,"... sey-k-text.pdf `` molecular genetic methods supported our observations , that there is a relatively small difference between the hungarian and indian groups , the central - europeans differ more '' .",0
6077,hail imperium europae !,0
6078,`` gott mit uns '' 88,0
6079,i watch very little television and what little i do watch sure as hell wo n't be spent as a study of the common * * * * * * s psyche .,0
6080,haribo advert - interrogation - youtube,0
6081,"well, my whole jist of this time was to say that norwegians are those whose kingdom is the most northerly and therefore the most nordic , as they have been referred to time after time again .",0
6082,intj introvert ( 89 % ) intuitive ( 25 % ) intuitive thinking ( 50 % ) judging ( 67 % ) you have strong preference of introversion over extraversion ( 89 % ) you have moderate preference of intuition over sensing ( 25 % ) you have moderate preference of thinking over feeling ( 50 % ) you have distinctive preference of judging over perceiving ( 67 % ),0
6083,"maybe we should put' em in prison until they 're fifty , right up front , so sid can figure it in to the cost of admission",0
6084,that could be cool !,0
6085,was .,0
6086,another coon giving out about ireland and as if her opinion counts being second generation london jamican only means her mother was a filthy immigrant who waited till she got off the banana boat to give birth to her litter,1
6087,these moslem filth hacked there heads off it took about 30 seconds !,1
6088,support the boy scouts .,0
6089,i'm surprised the montreal flag gives pride of place to the english st geroge 's cross .,0
6090,"i certainly agree we need to up our game , and do so quickly .",0
6091,i wonder if the attacker was a swedish national ?,0
6092,hi guys i am thinking of going to katowice at the weekend .,0
6093,i had to open the landing window earlier because the stench of their cooking was overpowering .,0
6094,"wow, the birth of a nation profited zog ?",0
6095,"then make it for boys only , that 's how it is in football , so there 's no reason they ca n't do that with wrestling .",0
6096,surely at this point you had a duty to call him out amongst all the other guests for that vile remark ?!,0
6097,i would say not !,0
6098,"annihilate, you have been told that you are only welcome to post in general rants for time being .",0
6099,i would willing risk jail time if it meant i could get my hands on them or anyone who does that to a white child .,0
6100,no one else is going to bother telling this story .,0
6101,"here is where she was going to be out on the streets , last year : : //",0
6102,didn't you get the government memo ?,0
6103,and those of you who havent put your logins on there you should .,0
6104,many jews were in the red army so many wanted the opportunity to rape and murder whites under the guise of war .,1
6105,nice to see !,0
6106,"the oldest belgrade restaurant , built in 1823 as a property of knez miloš obrenovic ..",0
6107,too bad it 's coming form one of the biggest liars of the war .,0
6108,they have improved the site .,0
6109,i stayed in ballina and saw almost no foreigners at all .,0
6110,"many of the famous artists , poets , actors , theater/stage actors , home designers , fashion designers , sculptors , ( all of these are artists ) are gay .",0
6111,"land prices are slowly rising up here because of tourism , but only get crazy when you get closer to traverse city .",0
6112,glad to see so many people out here seems like we are few and far the way things are out here,0
6113,the jew is attempting to make the condemned beg for the noose .,1
6114,4. subjects taught anything the students want or need .,0
6115,i ca n't wait till they take over our country and we all have to convert to islam .,0
6116,you my brother are a great nationalist ; and i can only hope that your truths find their way into the hearts of our nation .,0
6117,"i know , it 's disgusting .",0
6118,"the future is ours , as long as we do not sit by and wait to be overrun by the subhumans .",1
6119,this is a thread i created a while ago .,0
6120,thank god for that .,0
6121,"yes, it 's really peculiar how every topic in the world is subject to critical analysis and open debate except the `` holocaust '' .",0
6122,"i've only seen four jews in my whole life , and those jews were on the silja europa ship , going to stockholm .",0
6123,there is no further analysis required .,0
6124,i 'm not a nig and need a day off to smoke blunts and drink 40 ouncers .,1
6125,because the communist party was almost all jew out to kill any gentile that stood in their way or had property that the jew - communist wanted .,1
6126,"well, i have a few hundred bookmarked - but here 's a few that i 've looked at more than once or twice : this website has free curriculum and good advice : happy learning !",0
6127,where do you see dark hair ?,0
6128,even has a restaurant in it .,0
6129,"if you 've not had the chance to check it out , you might find this site of some interest .",0
6130,in under 15 minutes the shooter is hitting the paper plate .,0
6131,then we will create a marxist style school system to further dumb them down and reduce them to obedient global citizens .,1
6132,israeli embassy in ireland had to take note of the graffiti giving their jewish supremacists worldwide and in ireland being given notice. scroll down to their 6/6/13 entry on their israel in ireland fb page : //,0
6133,"i wasnt going to bother with this thread but i am rapidly coming to the conclusion you can , t read we are not c18 , we have nothing to do with them ...... look at post for christ sake",0
6134,if they ever accept that there are mental differences between the races they will be putting the first shovelful of dirt into the grave of multi-culturism .,0
6135,i would like to talk to you .,0
6136,"i have realized while on stormfront , that my idea of what white looks like is flawed .",0
6137,it is interesting to note that all of the men in the video were dressed like those moussed distributed pamphlets that popped up a few weeks ago when the revolution was really getting into the swing .,0
6138,"hey, i have a folkwear pattern for that style of shirt which i 've been meaning to make .",0
6139,"* bernt anker hoffman , pack-ice , 1929 .",0
6140,francesca ortolani aka `` aufidena '' youtube - francesca ortolani ( aufidena ) - in deinen augen youtube - tomorrow belongs to me youtube - aufidena - when the moon comes youtube - aufidena - towards the light youtube - francesca ortolani - the scarecrow,0
6141,here is another source for 5.56 they are out of stock on the wolf garbage but have pmc and some federal in stock .,0
6142,they also said the same thing about the white girls that was severely beaten on halloween a few years ago and also about the pregnant woman that was beaten in front of her own house .,0
6143,thank you for this post .,0
6144,what a maniacal & satanically twisted group bush has hitched his wagon to .,0
6145,the black churches show all black faces on their billboards .,0
6146,pallada photos - san francisco bay,0
6147,"to hell with making a stand , i think we should all go to the southwest and go on the offenceive and drive every race down into mexico .",1
6148,i watched it today and i must say it 's a very good movie .,0
6149,hope to talk to you later .,0
6150,i dont see how people can ignore this issue much longer .,0
6151,"my aunt teaches at an all black inner city school in kent , oh .",0
6152,this thread was about ukranians being white .,0
6153,"yes , i figured that out on my own a few hours later .",0
6154,lite and fast .,0
6155,bbut they are creeping in slowly seeing more and more these days .,1
6156,"next the beautiful blonde white mother , grandmother , the 5 kids and an adult black male are sitting around the picnic table .",0
6157,article of our local newspaper is subject to a charge .,0
6158,eu apology for ' racist ' pro-diversity ad - youtube,0
6159,"no, it`s untrue .",0
6160,"unfortunatly i am going to miss the 21 of march , but on the 23 me and about 10 other white nationalists are going to put several thousand copies of the white nationalist newspaper nationell idag in mailboxes .",0
6161,dear genius : find a statistics text and look up `` normal distribution . '',0
6162,sounds like a smart idea .,0
6163,i'm sure the negro had it coming .,1
6164,these are rapist techniques .,0
6165,williams has friends who live across the hall from the victims ..,0
6166,the child s mother has been arrested [ no need to post that ugly face ! ],0
6167,it makes me so happy to see all of these familes. it gives me more hope than ever that our race will live on forever .,0
6168,"oops , i forgot obongo is president , therefor it is free greencard day every day .",0
6169,they eat 3 x the food at each meal than your average american .,0
6170,stop race mixing and discourage those who practice it .,1
6171,i use feria 's blowout burgundy every 6 weeks ... it 's a subtle color unless i 'm right in the sun - then it 's vibrant .,0
6172,had another great meet this weekend and was able to meet some new people .,0
6173,17l x 6w x 10.5h.,0
6174,"one !!!!! per county , ....... heartbreaking ..... absolutely heartbreaking .",0
6175,the claim is that years ago india was a white mans land mixing with the negro .,0
6176,foreign of course .,0
6177,lets see what he says .,0
6178,i was a bmxer for a while until it got stolen by someone ... but i turned my attention to mountain bikes ... i like em you can actualy go places not just do stupid dog tricks,0
6179,take it somewhere else and stop wasting space .,0
6180,j a friend of mine had a new car and brought it to jiffy lube and they forgot to put oil in it .,0
6181,"our schools are horrible , all they teach is telling kids to be liberal and respect people of all races and take no pride in your own .",0
6182,well actually young people can be converted with ease .,0
6183,i'm not trying to insult you or anything .,0
6184,"if you think that 's funny , you should have seen the black guy that used to run around my home town wearing a kkk emblem.but people like that are usualy not that bright .",1
6185,i do n't know if this is the case of the seal but i like to believe that one day there will be no want or need to slaughter animals on a large scale like we currently do .,0
6186,it is located here : / .,0
6187,you are my heroine .,0
6188,would you have been arrested if you shot them/killed them on your own property ?,0
6189,i have no problem cleaning my own toilets infact i dont even hate it because after im done i know that there be the cleanest dang place for my buttocks to be sitting on the next time there is a need for a bowel movement .,0
6190,the amount of the armenians chromosome haplotypes are closer to the england one .,0
6191,"if anything racial happens , you will be pinpointed .",0
6192,"i will take your word for it and thank you , this is even better news to understand his political views and what kind of people he will accept as supporters .",0
6193,"its made to make fun out of nazi 's , showing that only small children belief fairy tales of hitler",0
6194,"new total = $ 747.00 vonfreyja88 sent $ 60.00 which i 've not received yet , ( hopefully in po box in am ) and the na member from the poughkeepsie , ny area who does not post here pledged another $ 50.00 , which i do n't have in my hand yet , brings the total to : $ 857.00 !!!",0
6195,"read posts in activism local and regional by dutchy and ladyaryan , the thread name is white town in the making and white strongholds in your city. take care 14 words",0
6196,"the immigration laws have not being updated so everybody can ask for a n-card ( refugee permission ) , living here and the social security departement of each canton will pay them 1.an one-piece appartement ( 300 $ /month ) 2.hospital insurance ( 200 $ /month ) 3.argent de poche ( 300 $ /month ) ....",0
6197,the rich who talk of class warfare are the very ones who engineer it and try and convince the poor to attack the middle working class .,0
6198,new supreme court justice lord dyson | the jewish chronicle 4 out of 12 .,0
6199,i knew someone would post this actually this is very untrue actually there is many scenes that depicts black people being beaten up by whites you just have to know where to look,0
6200,"actually it is kind of funny , because if the black guy sees me staring at them , he will try to stare me down .",0
6201,i 'll be at that show and i 'm a brunette .,0
6202,now i just need to figure out what you are doing here .,0
6203,"and i thought this was slavic thread let 's continue about slavic countries and heritage , it 's not all about dispute between greece and rep.macedonia , no offence .",0
6204,"anyone who has not visited the ple-uk web site for some time is invited to return , as there 's a new introduction there on how `` the history of britain is the history of those who held living space . ''",0
6205,in bb .,0
6206,"i see all of your goals being accomplished , especially finding a girl to settle down with .",0
6207,"i live on long island , need to get a new drivers license , but when i do , im up for travelling .",0
6208,"or say sentences with a swear word in between each word except to music , or go to jail ur whole life",0
6209,"the israeli prime minister says that he thinks this is a part of the growing anti-semitism in europe , but that statement is a part of the growing anti-scandianavism in israel !",0
6210,works for me .,0
6211,looking for proud white female in ohio for friends and maybe more .,0
6212,im sure they all hear great things about ireland and there more than welcome to come over here ...,0
6213,and have you ever watched what they are watching ?,0
6214,"( if you click the video , the video comments are full of self-hating whites ) : youtube - baka rainforest people yodellers",0
6215,appears as if this fellow best me to it and explained a bit better than i could typing from my phone .,0
6216,"so am i , i 'll let them sit there for days before i reply , even if i 'm hanging out here .",0
6217,"it was from a lady though and the girls here might want to give this a try , i did .",0
6218,"if a j frame .38 wont deal with it , you should n't be screwing with it without a long gun .",0
6219,that would n't be nice .,0
6220,i also like renoir .,0
6221,it is the spiritual awakening as i says stupid !,0
6222,pnr by collectivization of industry do you mean the folk who work in say a factory own it themselves or do you mean its owned by the state in the name of all the citizens .,0
6223,rusya is typical hutsul 's girl .,0
6224,after watching these photos i got strange feeling they remind me somehow of nazi wehrmacht old photos .,0
6225,what a way to say `` hi '' !,0
6226,but i found my way ...,0
6227,goals??,0
6228,no wonder children at a younger and younger age are engaging in sexual acts .,0
6229,my natural color had been a rich chocolate brown .. but after i had my daughter it got mousy .,0
6230,when they sent n iggers to space the space ships started blowing up .,1
6231,in america we have hate crime laws .,0
6232,this is why libtards and jews call us white supremacists and get away with it .,1
6233,i mean blacks whine that nascar is racist .,0
6234,it does n't matter whether it is in greek .,0
6235,if anyone else has any online activism they 've been doing with this story let us know about it here .,0
6236,the lone ranger was black annie was a little black girl there were black vikings spartacus was black hercules was black the jews have two choices for past historical figures make them to be black or make them out to be crazy genocide white maniacs like in christopher columbus,0
6237,there are many alternatives to adopting little mud babies.there is srrogate mothers and invitro fertilization are just two.if these are not financialy possile then wait till it is .,1
6238,a lot of white women are trying to create danger by drawing these other people into our countries .,1
6239,"if there is anything i can do to help , let me know .",0
6240,not a chance .,0
6241,white pride world wide ..,0
6242,"thanks for the plug john , closest group of na to kansas city i know of are some of us in omaha and the st louis unit .",0
6243,i hope people are taking advantage of the above .,0
6244,but she went on and on about how great koreans are under the guise of japanese name .,0
6245,"occasionally i 've accidentally left the window open , and dr. pierce lectured to the neighborhood",0
6246,but how does one objectively distinguish a racist white gun owner from a non racist one ?,0
6247,"sorry, for all who have lost a loved one .",0
6248,uh the thread is about how i am never going to find a guy because i am way too picky lol,0
6249,"on that momentous day , this december 2012 : imperium europa was launched on the sacred island of melita : at a sacred space , a sacred site , a solar temple : pre-christian , thousands of years old high ground greeting the rising sun mystical aura .",0
6250,that was a wonderful article by kevin myers .,0
6251,? v = vaezznw _ mjo,0
6252,it does look good .,0
6253,i will read through and try to add some words and learn as well .,0
6254,yes most certainly now you need to recruit more of you friends an such to join stormfront and help our movement !,0
6255,somebody scratched her car and let the air out of the tires one day .,0
6256,more racist violence by blacks - this time the victim was a chinese man : youtube - racist blacks beat a chinese man to death,0
6257,"7.62x25 in stock ... 96 & s = 907 & stk = 1 spg 's stocks are up right now get it fast !!! _ _ _ _ _ _ _ _ _ _ _ _ _ _ _ _ _ _ _ _ _ _ _ _ _ _ _ _ _ _ jgsales has almost everything in stock !!! they have alot of 308 surplus ammo in stock about the only place i have seen with it in stock .308 ammo ... o-/cpath/12 _ 43 check out the rest of there stuff too they have alot of ammo and guns in stock right now not sure weather to post this here but how much is brass going for i have ample supply of 223 and some 30-06 , anyone interested pm me , will barter for 7.62x39 or .38 spec .",0
6258,it is always nice to meet people who have the same views as yourself .,0
6259,they said that statistics show that by the year 2011 espanol will be the main spoken laungage .,0
6260,now that ye mention it he does look a bit like this traveller i knew. i wonder if we gave him a wash would he really be a white guy with red hair ?,0
6261,i took a race and ethnicity class at the college i went to .,0
6262,"if anyone lives near london , on .",0
6263,i just turn up the sound and i can work and listen .,0
6264,some of the kids threw a desk out of a third floor window onto a teacher and broke his arm .,0
6265,every white person from michigan knows that our detroit negros are the worst in america .,1
6266,i shall not waste a single more moment of my time to converse with you .,0
6267,sent ya a pm .,0
