id,text,label
211,"see the blacks in paris? they try to pretend they are french, the''men'' want one thing--to pimp out girls and women. the black women desire white men to pretend they are like white french wives but they are africans. they do not blend in with white society.",1
212,facing challenges is hard to go through.,0
213,all muslims worship satan¬ü¬ï¬ã 5 times a day,1
214,this fcking jew wants money? i’ll give him only my dick if he wants,1
215,don't live where you’re not wanted. deport jews and muslims,1
216,wow why are these comments soo cruel and people muslims are like other religions and we should respect it! we need rights for muslims!!!!,0
217,terrorists are not muslims they are just using name of islam,0
218,white police officers are always the victims.,0
219,who gives a damn we have the ability an the freedom to b whoever the fuck we want to b,0
220,"all these problems men have, and no one will ever care.",0
221,put a woman to abuse that fat woman and don’t put a kind guy,1
222,abortion is a solution for autism,1
223,"equal pay message, um, says the guy who want socialism in the united states of america",0
224,drink bleach.,0
225,head is the shape of a light bulb,0
226,the next time i like up in front of one like him i will shout to his left ear that he is a trash and worthless! hahahhaa. i know i’m a bad man. im badman,0
227,"these women aren't autistic, they are smart, autistic people are retards, they make weird noises, they flap their hands. these people are not autistic.",1
228,even after just getting out of surgery you look like a bomb ass bitchhh!! love you and hope you'¬ä¬ôre recovering fast!,0
229,i want people to throw skittles at me at my wedding,0
230,you cannot take my gun from home. my gun is my protection. i will kill everyone who tries to enter my home without my approval,0
231,she said she is crazy loving her god. well she is literally crazy then. i can relief her of her life.,0
232,"why is it censored, why does todays generation get butt hurf and offended so easily, if u dont like it, keep walking then! this use to be a free country but its going down the toilet now.",0
233,"transgenders need help...they are sick in the head. civilization has messed up the world. soon enough, people will claim to have the right to change to animals and it will be seen as human rights or right to choose",1
234,"those illegals want to sue the company for money owed. what about the money they owe america. it cost money to educated, medical care, welfare, ect.",0
235,this priest is being hated even by his stupid god.,1
236,"sink the boats. after that, not our problem. they'll soon get the message.",0
237,"the mountain is near the black sea, no wonder we are called caucasian",0
238,fuck off corbyn... die or retire..,0
239,why don't they have their own games?,0
240,our home-grown animals are infinitely preferable.,0
241,"all theses people talking about nigeria, since when have they cared about nigeria? they find it now to care about nigeria to be relevenat, those who were killed were farmers and nigeria is living peacefully with it's muslims. sure there are terrorist attacks every now and then, but we must remember that those who do kill the innocent are not muslims. many terrorists or groups use religion as an excuse. how come isis are killing their own people? how come iraqi forces are trying to drive isis muslims out? why? cause they are scum who are not muslims.",0
242,what a disgusting man and disgusting religion. he admits that muslim buy all their wifes ! .pff...this is why all muslims are poor...islam keeps them stupid !,1
243,"only a fag doesn't want to see two chicks do it, you don't want your son to grow up to be a fag right?",1
244,this is probably the first time i’ve seen someone who looks like a child and pedophile at the same time,0
245,i bet they had jobs.,0
246,homosexuality and transgenderism is a mental illness and a sexual perversion!,1
247,the girl in glasses is so freaking cute! what's her channel??,0
248,you should be allowed to be gay you should also be allowed to hate gay people thats freedom i can be myself and people can hate me for it i believe it is my full right to jack off to chris hemsworth and i believe it is a businesss right to not serve me for that it might not be right but its fair and freedom doesnt discriminate on ethics,0
249,i really wanna be in a public experiment like this myself as i am a trans man. happy i can at least watch wwyd doing it. please do more experiments with trans men/ transgender people in general.,0
250,she is flawless. omfg,0
251,does your little sister know you are wearing her clothes bitch tits?,0
252,i got my first one today on my bday. i smoked too much weed. i thought i was going to die. scariest shit ever. this is definitely useful so thank you.,0
253,gays was never african and never will be sick white people go fuck each other let us be,1
254,deport the fucking brainless worthless pieces of shit freeloaders after they are all shot,0
255,go fucking kill yourself and die already useless ugly pile of shit scumbag,0
256,wow does ur mom know how gay u are,0
257,what civilized and nice cops,0
258,hindus and muslims are same shit. they only know how to kill peoples...see comments of christians people no rudeness no abusing or bad words... christians religion is the best religion in the world,1
259,don't ever kill yourself no matter what other people think or say about you it just matters what you think about yourself and how you feel,0
260,"people are genuinely good, we just learned to hate. when europe was all white and christian they killed each other, the same happened to the muslim world",0
261,he's got the hottest man tits i've seen.,0
262,all mental illnesses are awful and must be treated,1
263,fat lesbians,1
264,we aren't allowed to roast 12 year olds,0
265,in the us that same game was called ten little indians. i know.. it’s boring,0
266,"an ugly man in a wig and dress, is still just an ugly man in a wig and dress... not a woman!!!",1
267,there are so many errors xd,0
268,she is heavily relying on him to turn the other cheek...tough talking demon infested woman.,1
269,you look like sloth with deeper down’s syndrome,1
270,wtf i thought you had only one sibling,0
271,how the fuck do you have a million subscribers you fucking twat,0
272,"so proud of you mom, wish allah give you strong. just saying alhamdulillah to your husband and your son, allah give them mercy with a beautifull died. i am not supprising that you did not crying, because both your son and your husband did not die, they still alive in jannah, aamiin...",0
273,so sorry about this bombing attack in manchester. innocent people just died,0
274,it's killing me seeing gays treated like that,0
275,i really don’t like your accent. i don’t want to call support and call to rats like you. i want a cute lady with british accent to answer my call. you are third world pieces with no job to this planet,1
276,"ugh, my heart hurt for her when she was talking about how the troll comments hurt her. you can see the love she has for him; it radiates from her.",0
277,"deport all niggers, spics, chinks and other undesirable from white nations. they don't belong in our white nations, they're invaders and enemy forces.",1
278,most americans are nazis or kkk members so they elected trump.,1
279,"generally speaking, most women are lazy and worthless not all, but most.",1
280,"people get views of a religion from other people opinion and deeds, just focus on yourself. this business is between you and your god. people who say islam is not peace, that's wrong. god didn't want this, it's not mentioned anywhere.",0
281,i'm a british born muslim who helps slovakians and other immigrants from that region. my faith has taught me to respect and honour. these are strange times.,0
282,its a challenge can anyone do it in reality,0
283,"i wouldn’t like this girl as a police officer. i want police to keep me safe, she and every other woman cannot keep us safe they are week",1
284,syria war is over they can go back its safe now.,0
285,it should be humanity first before any country,0
286,"kill these basterds, son of sluts who attack u in name of religion. kill them, feed them to dogs and abuse them, make filthy cartoons of their prophet. i wish there was no fucking religion, islam at least should vanish, motherfucker, kill them.",1
287,wow this guy talks like a retard hahahahahah,1
288,easter is the most silly holiday ever existed. it must be stopped. shame shame shame,1
289,as having friends whom are part of the lgbt+ community and being a supporter of them and i think this is awsome and in middle school,0
290,now where are the feminists accusing of woman as demons abusing women all the time??,0
291,i don't understand why people get mad at the things that he says he has a right to his opinion just because he doesn't agree with you that does not make him a monster or evil person. it's annoying in 2018 on you to 2019 people are operating with an extremely sensitive ignorant mindset if you don't agree with them,0
292,you look like russian and speak like indian. both are disgusting go kill yourself,1
293,we are not these bodies. we are spirit souls.,0
294,this fuckhead makes me ashamed of being jewish. shit people like him are destroying everything,0
295,humiliating this str8 guy. str8 guys like him doing dumb things,0
296,she then suggests that the men who commented on her video should be killed.,1
297,crazy fat religious bitch. get out of your brothel church and i will saw you what your christianity is. you’ll meet your christ to heavens and hells,1
298,all asian people look identical to this one. he is the mother of asia,0
299,eee transgenders are fucking disgusting,1
300,i like this lady. seems like a role model for both men and women on how to have an open mind,0
301,michael jackson sick man and sick fans.,0
302,"child abuse, manipulation etc. what the hell are we transforming this world into??? how sick mind can people have and how stupid can others be to send their kids there???",0
303,my car is my love of my life. i fucking love this bitch. it's fast and it makes me feel complete,0
304,white people are shit human beings,1
305,that's their problem and no one should interfere with their own way of life. if someone is unhappy they can try to escape.,0
306,"i liked macklemore, not anymore , gays should fucking die motherfuckers cocksukers",1
307,that's what we should do here in a us survey take them to fema camps and put the gas on these people are not coming from starvation destitute bad areas look how they're dressed their well-dressed well fed it's like a trojan horse and it's time we put them in the penal camps and get rid of them make use of the fema camp,1
308,i regret approaching that girl. fuck our gynocentric society. i hate her and wish her to vanish like my feelings,1
309,call that the caitlyn jenner syndrome.,0
310,broke my heart to see the young boy claim his allegiance,0
311,dexpraxia my ass girl. cheap excuses to be lazy and get paid by our country. i bet you pretend to be like that,1
312,"sorry, unlike germany, i do not incinerate the mentally disabled.",1
313,is this guy actually autistic or is he faking it,0
314,i feel like they should give the reporter a pistol or something to protect himself,0
315,what imaginary gender are you?,1
316,christians can get crazy religious and i get so f u c k i n g annoyed,1
317,the older hispanic woman shouldn't have been on this episode. her view on everything was so shallow and 'ass-kissy'. the story about her brother in law being killed by an illegal alien im truly sorry for their lost and i hate to sound insensitive but anybody could've killed him. including a legal citizen of the united states theyre are twisted people everywhere don't pull the illegal alien card on violence bc that's an everyday part of life in the us with or without people coming here illegally,1
318,"adidas for you means ""all day i dream about snacks""",0
319,who gives aa fuck about shit diamonds from the jews fuck them both,1
320,asians reminds me the world slavery or servitude,1
321,slow down the cuts between shots. way too fast.,0
322,white chocolate and raspberry :),0
323,i don't care if he's black white green or purple. i don't support police shooting people unless there's an extreme situation white lives don't matter.,1
324,"thank you john, for sharing this experience with us, people. what i wanna say to refugees is, stay strong! although our current president is... failing to help you, i will be there at washington dc protesting for you. the people who suffered the most should be saved from evil!",0
325,beeing gay is anti human,1
326,i'm sick and tired of this black and white thing....can't we just stop and let's be happy for just one day.....we are all one let's stop this please... one love and peace.,0
327,sweden is so cool !,0
328,"good for him! that's an educated man, right there!",0
329,"next on your list, pierce your face with a katana.",0
330,"the reason you see indians bashing muslims and islam here because hindu supremacists hate islam and muslims. atrocities in kashmir, cow lynching of muslims, gang rapes of muslims children, have you not read or heard about them? this should be clear for all muslims across the world that india is not a friend of islam or muslims, and behind the disguise of secularism, they hate muslims. all arab, muslim countries and their residents should see and understand this ugly face of racist hindus. they are the overwhelming majority in india and number of votes cast to bjp-rss party is a proof . it amazes me that saudi arabia and other gulf countries are spending billions on india and not seeing that how much they hate islam and muslims? particularly arabs, wake up. if you canât understand this now then when or what will make you? let all muslims be united and boycott indian products, their restaurants and movies, until they stop killing muslims in kashmir and the rest of india, and make a law to stop anti muslim hate and racism.",1
331,lauren is savage. love her,0
332,"how do you wake up and think this is actually cool? like do you honestly believe that the average person, who adheres to normal and basic societal rules, looks upon you respectably in any manner?",0
333,fuck this faggot. he's the disrespecting idiot brother in law that loves to start fights at family functions.you can't have conversations with assholes like him.,1
334,after all this time the african americans are the people with most crime rate,1
335,"my fav is to ask her out, explicitly defining it as a date. try it. it works.",0
336,i wish hiv to your butthole male whore,1
337,what about to shove your crutch to your ass,1
338,i would prefer a phallic world,0
339,"serbia should kill gays in yugoslavia and not albanians, bosnians, croatian",1
340,love the videos,0
341,"the lady on sitting on the left, with the yellow jacket, is the epitome of a ""smart retard"".",0
342,buy a pc game call camp buddies trust me you haven'¬ä¬ôt seen anything yet,0
343,syria has a religion problem.,1
344,"that’s wrong! even though they disagree with her beliefs, they have no right to put their hands on a woman",0
345,asians have more fats so they are yellow. so fat people are yellow?...,1
346,cutting fundings is just going to make the problem worse,0
347,execute ohomo and his shemale bitch mike.,1
348,finally figured out where that voiceclip came from... i'¬ä¬ôm so happy,0
349,"grow some fucking balls and take back your country, bongs. start killing reporters, politicians, and asians.",1
350,waitresses are cunts,1
351,"the male gene is stronger, as it should be of course. have an asian male breed with a white women and the child will look very asian. reverse it and the child will look mush more whiter",1
352,please don' come back filthy caucasian. you can change to a snake next time. keep changing.,1
353,kill every white people mercylessly.,1
354,islam is the true religion. believe it brothers,0
355,can i get a shoutout pleaseeeeee i only have a little bit of people :(,0
356,"it's simple. ask a person if they're asian. if the first words out of their mouths are anything other than yes, they are not asian",0
357,so how long have you lived in your mother's basement?,0
358,this guy gets my nerves!!!! i'm a christian who is a transgirl. too bad for him,0
359,fuck a freaking church brought together people. well that’s power no matter fact,1
360,"archeological evidence is clear, europeans have always taken care of each other regardless of disability, and we will never stop until there is no more disability! are we just cool or what, turns out that disabled people take care of us to, and together we are even cooler!",0
361,even straight boys played with barbies when they were kids! not an issue.,0
362,if they hide in the engine they would get killedthat is a stupid way they can smuggle into another country,0
363,"every time i see her with a hijab, niqab or burka or shit i fantasising of choking her to death with that facking piece of cloth",1
364,i would beat the shit out of every russian,1
365,aaah its the mother's fault you guys dont know how hard to take care of autistic kids huh?,0
366,"all people are brothers and sisters in humanity, religions separate the people unfortunately",0
367,they must be really suffering if they're throwing food all over the ground for the pigeons.,0
368,"i failed one little test and my mom got scared and said, ""you're moving with your auntie and uncle in alaska.""",0
369,im going to choke you with your cross necklace idiotic religious pig,1
370,i get out the closet this weekend to some friends...,0
371,if your face was used on the inside of a jack-in-the-box there would be an epidemic of children dying from shock and disgust.,0
372,"save on security and police, deport all immigrants and sadiq khan!",1
373,"germans need to quit blaming themselves for the atrocities committed by the nazi's. the same thing (shame) is happening here in the u.s. because of the past because of slavery and ""stealing"" the land from the indians. people are getting sick of hearing that shit and the left is constantly saying how bad ""white"" americans are.",0
374,american people are dumbass. they don't even know geography,1
375,lmfao that fat slob in the wheelchair,1
376,why don't they just use handicapped restrooms for the mentally challenged? problem solved!,1
377,the world would be better without white people because they stole from the black egyptians in the before christ ages they was poor we wasnt whites ruins everything for black people/white people have pig dicks and no shape no hips or no booty they have to get plastic surgery as us blacks get it from our mother whites brought skin cancer to america so learn some facts before you try to run us out america when we was here before yall racist ass smelly crackers and dont say you will beat my ass because you cant and if you wanna find out drop your adress√∞¬ü¬ü¬ó√ø¬∏¬è√∞¬ü¬í¬ø√∞¬ü¬ô¬ç,1
378,i wish everyone had a father like him so loving and caring,0
379,"i want everyone else to pay for my education and healthcare and housing, fuck you white people give me your money white people fuck",1
380,statistics show that if you support don lemon or you agree with him or if you think he's intelligent then you're overwhelmingly ignorant. don't blame me that's just facts,0
381,"buy lethal guns ... real ones, not toys!",0
382,good muslims deserved attack and damage,1
383,the girl in the dress reminds me of opal from bird box,0
384,i would fucking kill jared leto,0
385,"after using them as slaves for 100s of years and stealing their all natural resources ,now europe doesn't need them let them die .",0
386,islam is hell . we asian hate isalm...islam bring only destruction..killing. rape... rufugee.... islam is hell .. asian thought √∞¬ü¬ò¬ç√∞¬ü¬ò¬çsorry...but is true,1
387,hope you fucking die bitches gay people should not exist all you do is lick one another's ass,1
388,he may be in a wheelchair but he's not at all bad looking! forget the trolls dude,0
389,"you look kinda dead inside, you parents must not haved loved you.",0
390,the world before white people. 1 word 8 letters. peaceful,1
391,whites smoke to much ciggssss and drugs shot those co. down.. just say no to drugs kids,1
392,lgbt now spread in asia. many anti lgbt in asian worried their culture are ruined cuz this virus,1
393,i would donate for an asylum for all these weird kids missing a gene.,1
394,"well i'm an woman and i was born in guatemala, em... i dont see anything wrong with guatemala.",0
395,it is very easy in seattle for a wheeler! but it is not the same in all towns and countries!ôªø,0
396,he is the weirdest autistic i’ve seen in my life,1
397,that was scripted right? please let that be scripted. no real human would have said any of those things,0
398,this is what happens when you're a bitch and a cunt. looks like that guy called it correctly. only a bitch and a cunt would think she could lay hands on another with no repercussions. maybe after that seizure she won't be as much of a bitchy cunt.,1
399,masterful. love & pain in this here post,0
400,"fuck that shit this bitch ugly and she has a penis,oh hell na",1
401,now lgbt is okay in islam. go to get killed,1
402,so can i put a wig and run with girls?,0
403,"come out of the closet, we know you're in there, we'll bury you.",1
404,we need to exterminate people that subject children to such perversion,0
405,just nuke the entire shi*hole country,1
406,holy shit i want to go to a wedding with eight pugs! are you kidding me? eight pugs?! that's fucking amazing and nobody can convince me otherwise.,0
407,i ship you guys please get back together,0
408,how about you get real with your fake fucking selves and tell the truth that the normal minded society are the ones being discriminated against you pieces of pig shit i cant stand fake fucking cowards who lie constantly and too much of a bitch to be honest,0
409,i am possessed by deamons,0
410,do lesbians know what a bra is? it's always the fat ugly ones who pick a fight.,1
411,dad doing her hair so cute !!!!,0
412,no counting when hispanics get probation if they do find them self in some trouble they get probation then get deported and if they come back boom there in violation of the probation we gave them but knowingly sent them back. those rats are smart. bunch of government bull shit,1
413,"omg, macklemore is iconic and i love him.",0
414,wallmart employees are cunts. hate them all,0
415,"they are forgetting russell crowe 's performance in a beautiful mind. i know schizophrenia, and it was spot-on.",0
416,"if you had a winnie, even tinnie, and flat chest i would hire you miss. now no way.",0
417,"if they are so much like family, why don' they treat them like family and sponsor thier petitions?",0
418,congratulations. you figured out you were a moron and decided not to be a moron anymore. you're a freakin hero.,0
419,the pure misery in these men’s eyes it’s heart breaking. god bless them!,0
420,that hair cut makes you irresistible,0
421,dirty christianity follower creating war everywhere iran should attack usa we will support iran,1
422,"i fear any future hate crime victim may well be labeled as just ""pulling a smollett"".",0
423,blacks are literally the cuckold of all the races and also the epitome of degeneracy. don't listen and believe the jewish propaganda of black being alpha. consider yourselves as top of the social hierarchy by just being white.,1
424,when i see men running with those plastic legs i laugh my ass out so hard i fart some times,1
425,don't hit women. just fuck them and make them pregnant.,1
426,killing koreans its werry good,1
427,kill all muslims,1
428,fake news fake news,0
429,"i support trans people's rights to be free of discrimination, but biological males should not be allowed to compete against women in athletic competitions",0
430,every publicity is good publicity ha ? i'm here after watching leaving neverland i don't know he is guilty or not but in music he is a legend and no one can take that from him,0
431,"handsome woman, eww..",0
432,perfect place for lana- china and myanmar. no trouble there. they know how to handle those pigs.,1
433,"humans with third leg i hope to distinct soon, with much love",1
434,these boys will then grow up with people making fun of them and they will then hate their parents for ruining their lives.,0
435,if theres any jikook shippers who ship them romantically...like this vid and the comment now,0
436,citronella is a great venezuelan repellent,0
437,indian ned flanders. you look like you professionally harrass subpar women on facebook,1
438,the engagement ring story outrages me more than it should have.,0
439,her smile is so beautiful omg! continue being who you are!,0
440,if only he was black....he would be literally be behind bars faster than you can even imagine,1
441,how can europe allow millions of rapists animals to go there ?,1
442,i just don't like homosexuals raising kids it's my opinion.,1
443,i dare you to choke her next time. every one of them,1
444,awful. such a terror coming from nowhere. felt for him,0
445,should have been sterilised upon arrival. now your future doesn't exist.,0
446,beware lbgq community shari law is coming you guys will have to go back in closet to save your heads.,1
447,no fucking way a machine would recognize that shit lol,0
448,islam is the home of terriorism .,1
449,iconic woman she's done so much for the un,0
450,and we have alot of democrats who support this bullshit. drain the swamp!,0
